"relevant","tweet_text","tweet_id","humanitarian_label","original_humanitarian_label","event_type","dataset","year","event_name","original_relevant_label"
"True","Cruuuuud. Tornado warning for Denton County. And the TV isn't working. And the Dallas news sites aren't helpful. Cruuuuud.","99043655413302657518","","","storm","ISCRAM2013","2011","2011 Joplin tornado",""
"True","Tornado on the ground in Azle headed right toward TMS","99557170222666235939","","","storm","ISCRAM2013","2011","2011 Joplin tornado",""
"True","US tornado toll rises to 122 (AFP) http://dlvr.it/StLMh","99424942198982913718","","","storm","ISCRAM2013","2011","2011 Joplin tornado",""
"True","Tornado sirens. This is scary.","99669004357281797899","","","storm","ISCRAM2013","2011","2011 Joplin tornado",""
"True","Sitting in shelter waiting to see if the tornado hits my house. #anxious #scared","99092306482313588188","","","storm","ISCRAM2013","2011","2011 Joplin tornado",""
"True","US: Joplin Mo. tornado had more than 1 vortex http://fxn.ws/k50jUl","99841846524435486785","","","storm","ISCRAM2013","2011","2011 Joplin tornado",""
"True","Tornado reported 2 miles west of Azle TX. This is to the northwest of Ft. Worth. Radar warning... h ...","99606907160130357168","","","storm","ISCRAM2013","2011","2011 Joplin tornado",""
"True","Whew that was close. A few broken windows but otherwise survived the tornado.  Now to pick up debris for the rest of the evening.","99990763854634669804","","","storm","ISCRAM2013","2011","2011 Joplin tornado",""
"True","This is a serious situation for the DFW Metro. If you know anyone in the central to northern subs have them take c ...","99865362371643814080","","","storm","ISCRAM2013","2011","2011 Joplin tornado",""
"True","#Joplin stats: 124 people confirmed dead 750 treated at hospitals about 1500 still unaccounted for; approx 8000 stru ...","99322149754868073262","","","storm","ISCRAM2013","2011","2011 Joplin tornado",""
"True","Tornado Warning for Coal County in OK until 8:30pm CDT. #okwx","99596002254201688374","","","storm","ISCRAM2013","2011","2011 Joplin tornado",""
"True","Holy Hell... Before & after photo of the #Joplin tornado: http://bit.ly/iwqNmq - via @tamarlevine @andyfortson","99603389295642226395","","","storm","ISCRAM2013","2011","2011 Joplin tornado",""
"True","Damaging wind threat coming into Tulsa OK #tornado #okwx","99703363532050235452","","","storm","ISCRAM2013","2011","2011 Joplin tornado",""
"True","@hidama @ambersplace On Thursday we'll collect supplies 7a-7p at 23rd St Zarco. Water Food Toiletries and... http://bit.ly/mbWCzD #Joplin","99282732440435583875","","","storm","ISCRAM2013","2011","2011 Joplin tornado",""
"True","DENTON: Take shelter. Possible tornado just to the west of where I-35W and I-35E meet.","99727104760849798684","","","storm","ISCRAM2013","2011","2011 Joplin tornado",""
"True","@facethewind_com Awesome tornado picture Dave. May we use it on msnbc.com?","99765236589761602582","","","storm","ISCRAM2013","2011","2011 Joplin tornado",""
"True","Platte County MO until a tornado watch until 3a.m.","99770978377860218770","","","storm","ISCRAM2013","2011","2011 Joplin tornado",""
"True","Psalm 7:13  [God] hath also prepared for [the wicked] the instruments of death; he ordaineth his arrows against the persec ...","99788683642308996390","","","storm","ISCRAM2013","2011","2011 Joplin tornado",""
"True","Rice County has again been placed under a Severe Thunderstorm Warning until 8pm. Currently Barton County is under a Tornado Warning.","99621652057316219605","","","storm","ISCRAM2013","2011","2011 Joplin tornado",""
"True","Tornado warning for N. Tarrant County TX (northern Fort Worth area).  Softball size hail possible too. Warning info: h ...","99668266094000089737","","","storm","ISCRAM2013","2011","2011 Joplin tornado",""
"True","Text REDCROSS to 90999 to help the victims of the Joplin tornado.","99706785982850005849","","","storm","ISCRAM2013","2011","2011 Joplin tornado",""
"True","Speechless. RT:@slmandel If the tornado wreckage photos haven't gotten to you this before-and-after in Joplin will. http: ...","99616851352080000095","","","storm","ISCRAM2013","2011","2011 Joplin tornado",""
"True","#SAFETYALERT Folks in #Oklahoma #Kansas #Arkansas & #Missouri watch the @weatherchannel #TheWeatherChannel for #tornado dangers in your area","99012432413247245808","","","storm","ISCRAM2013","2011","2011 Joplin tornado",""
"True","Rep. Long @auctnr1 on #FEMA response to #Joplin tornado: ""On a scale from 1 to 10 I'd put 'em at a 12.""","99523466454226946375","","","storm","ISCRAM2013","2011","2011 Joplin tornado",""
"True","After saying he'd withhold tornado relief funds National Weather Service upgraded Eric Cantor to a category-5 Asshole.","99661736934843850047","","","storm","ISCRAM2013","2011","2011 Joplin tornado",""
"True","That artic Vs tornado I mentioned earlier... http://goo.gl/suVye  The driver is apparently OK - result.","99382209606679217462","","","storm","ISCRAM2013","2011","2011 Joplin tornado",""
"True","Tornado warning now in Washington County and NE Osage County  OK...take shelter now. #okwx","99406882757932201525","","","storm","ISCRAM2013","2011","2011 Joplin tornado",""
"True","if you live in northern tarrant county stay alert. a tornado may be on the ground near azle. its moving east at 40mph.","99339671366093003616","","","storm","ISCRAM2013","2011","2011 Joplin tornado",""
"True","SPC Tornado Watch 363 Status Reports http://dlvr.it/StNQS","99193123768347496584","","","storm","ISCRAM2013","2011","2011 Joplin tornado",""
"True","Ghoshen/Springtown in Parker county TAKE TORNADO PRECAUTIONS","99801339424687989741","","","storm","ISCRAM2013","2011","2011 Joplin tornado",""
"True","June Advertising Special! 6 spots open and 100% of proceeds will go to help #Joplin Mo Tornado Victims. Please RT!  ht ...","99689027996509591898","","","storm","ISCRAM2013","2011","2011 Joplin tornado",""
"True","Birmingham tornado debris cleanup contracts go to 3 firms; mayor... http://bit.ly/kK5iLe #Birmingham #AL","99350569811037279689","","","storm","ISCRAM2013","2011","2011 Joplin tornado",""
"True","JFC. RT @TWCBreaking: New tornado watch until 3am CDT for western MO.  Includes #Joplin.  More info: http://wxch.nl/k6CgxX","99905068230796300640","","","storm","ISCRAM2013","2011","2011 Joplin tornado",""
"True","Collin/Dallas  County need to be ready to take cover within the next 20-30 minutes. You need to be  ...","99300270499048394231","","","storm","ISCRAM2013","2011","2011 Joplin tornado",""
"True","Rangers game in a tornado? Perf. @mirandahuebner","99725533561263297287","","","storm","ISCRAM2013","2011","2011 Joplin tornado",""
"True","Tornado Watch just issued for western and southwestern Missouri till 3AM. Does NOT include Columbia or Jeff City at thi ...","99666551296846793852","","","storm","ISCRAM2013","2011","2011 Joplin tornado",""
"True","Just watched the news. Am sorry for the people living in Missouri they're place became devastated after the tornado attack","99660462608168044262","","","storm","ISCRAM2013","2011","2011 Joplin tornado",""
"True","Obama heading to tornado-slammed Missouri this weekend | OnyxBook","99756685302616487396","","","storm","ISCRAM2013","2011","2011 Joplin tornado",""
"True","@MarioLopezExtra Actor @paulwalker47 's charity #ROWW.org needs #Donations so that they can deploy a team to #Joplin. Plz RT #HelpJoplin","99336368549952523453","","","storm","ISCRAM2013","2011","2011 Joplin tornado",""
"True","Triage: Safety first then shout/move walking wounded to safe place  #1stAid4 #okwx #Joplin","99850141350393531197","","","storm","ISCRAM2013","2011","2011 Joplin tornado",""
"True","my friend near joplin is a ham radio operator and he was correct. #tornado","99031472552363900224","","","storm","ISCRAM2013","2011","2011 Joplin tornado",""
"True","Tornado reported in Denton County Texas near I-35 W and FM 407. @Ambieno","99558890446054277178","","","storm","ISCRAM2013","2011","2011 Joplin tornado",""
"True","Any idea what KFOR is using for live streaming video from reporter's cars chasing the storms? #okwx","99146215040890921721","","","storm","ISCRAM2013","2011","2011 Joplin tornado",""
"True","@TheEllenShow Actor @paulwalker47 's charity #ROWW.org needs #Donations so that they can deploy a team to #Joplin. Plz RT #HelpJoplin","99088616146834472754","","","storm","ISCRAM2013","2011","2011 Joplin tornado",""
"True","Insane tornado warning....? Cool. Let's hide.","99903617013421199593","","","storm","ISCRAM2013","2011","2011 Joplin tornado",""
"True","Cantor/GOP say no aid 2 tornado victims!! really! R these the ppl U want 2 run our country?? http://bit.ly/jrZKNd #Joplin","99290594993064712523","","","storm","ISCRAM2013","2011","2011 Joplin tornado",""
"True","Damaging wind threat coming into Tulsa OK #tornado #okwx","99709966478374211436","","","storm","ISCRAM2013","2011","2011 Joplin tornado",""
"True","Tornado sirens just went off in Tulsa.  http://twitpic.com/524dsf","99317303723949672157","","","storm","ISCRAM2013","2011","2011 Joplin tornado",""
"True","Sitting front and center at #StMichael city council tonight. Let's hope for a quieter night than 5-10-11 (two weeks ago) #tornado.","99296249783857486716","","","storm","ISCRAM2013","2011","2011 Joplin tornado",""
"True","Only in Arkansas the ice-cream man would be still driving around neighborhoods when there's about to be a tornado!!  http://t.co/2TxXCJ0","99854809628538752745","","","storm","ISCRAM2013","2011","2011 Joplin tornado",""
"True","MSSU establishes fund for faculty staff and students impacted by tornado -... http://fb.me/GQiEYO0q","99696158837032255595","","","storm","ISCRAM2013","2011","2011 Joplin tornado",""
"False","No Kris we didn't cut the budget so @ericcantor cancelled it RT @KrisKetz 3am tornado watch Kansas City metro extends south to Joplin.","99851971215982477100","","","storm","ISCRAM2013","2011","2011 Joplin tornado",""
"True","3am tornado watch Kansas City metro extends south to Joplin. #fb","99759954709459030729","","","storm","ISCRAM2013","2011","2011 Joplin tornado",""
"True","Don't forget 2 check Safe & Well site if U R still not able 2 connect with #Joplin https://safeandwell.communityos.o ...","99426312124937526454","","","storm","ISCRAM2013","2011","2011 Joplin tornado",""
"True","@mpike4 RT @LJWorld: Tornado watches now cover ALL of northeast Kansas including Douglas County.  #ksstorms","99202221701013874131","","","storm","ISCRAM2013","2011","2011 Joplin tornado",""
"True","U no y I luv twitter? Ive met peeps all across the usa. Can my tweeps pray/have good thoughts for my girl @soonerleesa? Shes in tornado ally","99902193018774319874","","","storm","ISCRAM2013","2011","2011 Joplin tornado",""
"True","BREAKING - NWS says Joplin tornado was an EF-5 with wind speeds over 200 mph.  Death toll now at 122 with 750 hurt.","99272315313421679484","","","storm","ISCRAM2013","2011","2011 Joplin tornado",""
"True","New Tornado watch just issued for Triangle and NE NC. #ncwx","99208458799594577596","","","storm","ISCRAM2013","2011","2011 Joplin tornado",""
"True","@Tyrese Actor @paulwalker47 's charity #ROWW.org needs #Donations so that they can deploy a team to #Joplin. Plz RT #HelpJoplin","99608037948002378948","","","storm","ISCRAM2013","2011","2011 Joplin tornado",""
"True","InfoMusic : Lauren Alaina's 'American Idol' Run Brightens Tornado-Weary Hometown http://dlvr.it/StK6t","99038150785148451412","","","storm","ISCRAM2013","2011","2011 Joplin tornado",""
"True","This dude on cnn is being interviewed about the tornado in a dominos pizza uniform","99686615583053271798","","","storm","ISCRAM2013","2011","2011 Joplin tornado",""
"True","DEVELOPING: RT @MyTexasWeather: AMATEUR RADIO REPORTS SEVERAL HOMES DAMAGED BY TORNADO IN SPRINGTOWN TX (Parker Co ...","99947383009694634043","","","storm","ISCRAM2013","2011","2011 Joplin tornado",""
"True","Tornado watch just issued for Joplin Mo","99965703442749613264","","","storm","ISCRAM2013","2011","2011 Joplin tornado",""
"True","#tornado victims USA is watching in horror with you.","99867874684899063643","","","storm","ISCRAM2013","2011","2011 Joplin tornado",""
"True","Tornado in broken arrow http://ow.ly/1cQOkn","99476096489078890441","","","storm","ISCRAM2013","2011","2011 Joplin tornado",""
"True","St. John's Regional Medical Center employees please check in at 888-986-3729 they are wanting your status. #Joplin #fb","99441761471583933134","","","storm","ISCRAM2013","2011","2011 Joplin tornado",""
"True","q2 @USAToday says the tornado in Joplin was one of the deadliest in history.  #agchat","99761697525956222857","","","storm","ISCRAM2013","2011","2011 Joplin tornado",""
"True","NEW Tornado Watch now includes western #MO incl #KC #Joplin #Springfield until 3am...greater concern for damaging wind i ...","99837019961727645419","","","storm","ISCRAM2013","2011","2011 Joplin tornado",""
"True","Tornado warning for Denton County until 8:15","99192864469783156730","","","storm","ISCRAM2013","2011","2011 Joplin tornado",""
"True","#Tornado Warning for Wise County. Storm moving east and will impact Denton county in the next 30 minutes.  #txwx","99666108922678654248","","","storm","ISCRAM2013","2011","2011 Joplin tornado",""
"True","Lurch thanks for all the tweets from Tornado Alley...#fail.","99970567409804973801","","","storm","ISCRAM2013","2011","2011 Joplin tornado",""
"True","The tornado blew this bible verse in my back yard. Read the first line...that's disturbing.  http://twitpic.com/52435m","99062633363530768892","","","storm","ISCRAM2013","2011","2011 Joplin tornado",""
"True","Deadly tornado kills 122 leaves 'twilight zone' in its wake: The tornado that struck Joplin Missouri Sunday killed 122 people aut...","99304827249233443122","","","storm","ISCRAM2013","2011","2011 Joplin tornado",""
"True","Tornado reported in Denton County Texas near I-35 W and FM 407.","99944854931048195333","","","storm","ISCRAM2013","2011","2011 Joplin tornado",""
"True","Piedmont #Oklahoma with just devastating damage near Arrowhead RD and Richmond RD. Tornado path approx 35 miles 1/2 mile wide.","99060555126656585350","","","storm","ISCRAM2013","2011","2011 Joplin tornado",""
"True","Tornado threat spreading into North Texas. Cooke Wise and Parker Counties under Tornado Warnings currently","99534972790578076697","","","storm","ISCRAM2013","2011","2011 Joplin tornado",""
"False","-- Red Cross says cash now primary need in Joplin: http://t.co/sd4cmL1 @semissourian #Joplin #tornado #disa ...","99549058046623753127","","","storm","ISCRAM2013","2011","2011 Joplin tornado",""
"True","Uploading video of Canton OK tornado shot from aprox 200yards away contact @kdrmedia if intrested","99549097585674446196","","","storm","ISCRAM2013","2011","2011 Joplin tornado",""
"True","@calebturmanATOR when isn't there a tornado warning... especially where I'm at.","99269393150094821643","","","storm","ISCRAM2013","2011","2011 Joplin tornado",""
"True","My heart goes out to the people of #Joplin Missouri. Be strong you guys can make it through. #GodSpeed","99788033329721679865","","","storm","ISCRAM2013","2011","2011 Joplin tornado",""
"True","#OUN continues Tornado Watch for  Atoka Bryan Canadian Carter Cleveland Coal Garfield Garvin Grady Grant Hu ht ...","99449720651295667865","","","storm","ISCRAM2013","2011","2011 Joplin tornado",""
"True","#OUN continues Tornado Watch for  Atoka Bryan Canadian Carter Cleveland Coal Garfield Garvin Grady Grant Hu ht ...","99302786189859927012","","","storm","ISCRAM2013","2011","2011 Joplin tornado",""
"False","#joplin numerous TVS southwest of town 70 miles","99611558134748056091","","","storm","ISCRAM2013","2011","2011 Joplin tornado",""
"True","Love love love storms! We had a tornado warning last night though that was a bit much @Literarygrrrl @glennrogers42  @lympha13  #pubwrite","99501214561102890392","","","storm","ISCRAM2013","2011","2011 Joplin tornado",""
"True","Oklahoma Alabama Missouri tea party people.  Call Dick Armey about a free market solution to tornado damage.  We'll wait. ...","99332954755419174080","","","storm","ISCRAM2013","2011","2011 Joplin tornado",""
"True","Was watching @KFOR's tornado coverage earlier. Their chopper pilot went off the air to land and help people on the ground out. Amazing.","99919234743195563163","","","storm","ISCRAM2013","2011","2011 Joplin tornado",""
"True","Yup I havethis Grill turned on as this tornado heads right for is.  http://lockerz.com/s/104527524","99440420731736942738","","","storm","ISCRAM2013","2011","2011 Joplin tornado",""
"True","Weather service issues #tornado watch for western Missouri extreme eastern Kansas http://on.cnn.com/k1ZN2b","99363964203116117626","","","storm","ISCRAM2013","2011","2011 Joplin tornado",""
"True","Tornado in Oklahoma on the ground for 50 miles. Unheard of. #prayersneeded","99611340572392035573","","","storm","ISCRAM2013","2011","2011 Joplin tornado",""
"True","Actor @paulwalker47 's charity #ROWW needs #Donations so that they can deploy a team to #Joplin. Please visit www.ROWW.org ..#HelpJoplin RT","99112253411453313383","","","storm","ISCRAM2013","2011","2011 Joplin tornado",""
"True","#tornado warring for Northern Parker county #texas","99612539529503387330","","","storm","ISCRAM2013","2011","2011 Joplin tornado",""
"True","State EOC remains activated due to severe weather - Situation Update #2  http://1.usa.gov/jdXnJ1 #okwx","99407936013691665077","","","storm","ISCRAM2013","2011","2011 Joplin tornado",""
"True","Joplin in tornado watch box....nxt 4-5 hrs","99973341628918428583","","","storm","ISCRAM2013","2011","2011 Joplin tornado",""
"True","Rain tornado rain rain more tornadoes. http://wapo.st/j814SD #springfromhell","99703841937899750644","","","storm","ISCRAM2013","2011","2011 Joplin tornado",""
"True","Video of KFOR-TV storm chaser nearly getting hit by power pole during tornado chase -- http://is.gd/eC7WOw","99751780827347864873","","","storm","ISCRAM2013","2011","2011 Joplin tornado",""
"True","In #Reno Texas 3.5"" hail showing up on RADAR...works well with softball sized hail for W Tarrant County #Texas.  #TXwx","99314275559737471632","","","storm","ISCRAM2013","2011","2011 Joplin tornado",""
"True","Joplin tornado was EF5. The Finger Of God. 6 miles long 1800 acres of destruction 1500 missing 126 dead. #nowords","99311664797194153102","","","storm","ISCRAM2013","2011","2011 Joplin tornado",""
"True","NWS DETECTED A DEVELOPING TORNADO 7 MILES NORTHEAST OF MINERAL WELLS STATE PARK... MOVING EAST AT 40 MPH","99925007790586453473","","","storm","ISCRAM2013","2011","2011 Joplin tornado",""
"True","@wakingrose87 Tornado touches down in Canadian county Oklahoma! That near your area??","99294391489980050149","","","storm","ISCRAM2013","2011","2011 Joplin tornado",""
"True","This is out of control.  #arwx RT @nwbartholomew: Word on the street is that NWA Wal*Marts have closed in anticipation of the storms.","99673510037997685391","","","storm","ISCRAM2013","2011","2011 Joplin tornado",""
"True","#Tornado earlier near Chickasha OK via @myria101.  This is headed toward Moore NW Norman S. Okla. City!!  http:/ ...","99531622012672714558","","","storm","ISCRAM2013","2011","2011 Joplin tornado",""
"True","A little bit of rotation but no tornado yet forming near Little-OK. Y'all keep safe and sheltered. #OKWX","99778557654303586690","","","storm","ISCRAM2013","2011","2011 Joplin tornado",""
"True","I just know the tornado alerts are gonna get in the way. It's not that IDC; I just wish the weather could get itself together for Glee.","99278772925807750158","","","storm","ISCRAM2013","2011","2011 Joplin tornado",""
"True","DIRK HELP US!! // RT @wfaaep: TORNADO WARNING - DENTON COUNTY  8:15PM","99774636258801219436","","","storm","ISCRAM2013","2011","2011 Joplin tornado",""
"True","Even more -- RT @NBCDFWWeather: Tornado Warning for Cooke Cty.  - Possible tornado 8 miles west of Valley View.  Rshade","99888322895744770695","","","storm","ISCRAM2013","2011","2011 Joplin tornado",""
"True","OK AL MO tea party people - Call Dick Armey about a free market solution to tornado damage. We'll wait. #p2","99599464211430942277","","","storm","ISCRAM2013","2011","2011 Joplin tornado",""
"True","Possible developing tornado between Peaster & Poolville in northern Parker Co.  Tornado Warnings in effect in Parker Wise & Cooke Co.s - DF","99781355840805291874","","","storm","ISCRAM2013","2011","2011 Joplin tornado",""
"True","Excuse my rambling in the video I just posted. Just take in the scenery and read the bottom to volunteer/donate. #Joplin","99361175521659126916","","","storm","ISCRAM2013","2011","2011 Joplin tornado",""
"True","#Tornado outbreak beginning in North Texas. #txwx","99012195592053741119","","","storm","ISCRAM2013","2011","2011 Joplin tornado",""
"True","#Tornado outbreak beginning in North Texas. #txwx","99009772354863152692","","","storm","ISCRAM2013","2011","2011 Joplin tornado",""
"True","OK news reporting fatality due to SOFTBALL sized #hail! Please seek shelter if you're in the path of these monsters! #severewx #tornado","99078343277952735845","","","storm","ISCRAM2013","2011","2011 Joplin tornado",""
"True","please pray for the tornado victims.. PLEASE..","99474137550279141182","","","storm","ISCRAM2013","2011","2011 Joplin tornado",""
"True","Tornado straight ran through his truck hope he's okay.  http://lockerz.com/s/104523996","99605588469305231675","","","storm","ISCRAM2013","2011","2011 Joplin tornado",""
"True","Please donate what you can to help and assist #Joplin and those impacted by the most recent tornadoes and those on the ...","99790327171785272032","","","storm","ISCRAM2013","2011","2011 Joplin tornado",""
"True","The Timbers will collect for the Red Cross  to help tornado victims at Sunday's match.  Capt. Jack Jewsbury is a nat ...","99405270839633200297","","","storm","ISCRAM2013","2011","2011 Joplin tornado",""
"True","Shoes will be on the way to #Joplin this weekend via our partners @crosspoint_tv @Soles4Souls @cpmissions","99836157080374848273","","","storm","ISCRAM2013","2011","2011 Joplin tornado",""
"True","How are 1500 still unaccounted for in #Joplin!???","99290416442707683148","","","storm","ISCRAM2013","2011","2011 Joplin tornado",""
"True","Posible #Tornado on ground near Admore #Oklahoma. People should seek shelter now! #OK","99039247484994562324","","","storm","ISCRAM2013","2011","2011 Joplin tornado",""
"True","Dear God I said I wanna 'tour N.A.D.O.' not 'tornado.' This sucks! -Guy from Joplin MO who prays for things that god hears incorrectly","99714116378387364862","","","storm","ISCRAM2013","2011","2011 Joplin tornado",""
"True","Tornado warning has been issued for Tarrant County TX!!!!!","99065580371433584350","","","storm","ISCRAM2013","2011","2011 Joplin tornado",""
"True","Live stream tornado coverage headed to Tulsa http://bit.ly/mws2tK","99684995146839876855","","","storm","ISCRAM2013","2011","2011 Joplin tornado",""
"True","@crosschurch had over 100 serving @calvaryjoplin tornado relief today supply distribution organizing cleanup and assess ...","99249981874902967908","","","storm","ISCRAM2013","2011","2011 Joplin tornado",""
"True","Tornado Watch now for entire metro area.  Just issued.","99691043826643713674","","","storm","ISCRAM2013","2011","2011 Joplin tornado",""
"True","Truly amazing 2C ppl passing by in ATV's offering free food & water to residents & press!  Good people here in #Joplin","99140414458015606375","","","storm","ISCRAM2013","2011","2011 Joplin tornado",""
"True","#Joplin MO now under a #tornado watch until 3 a.m. #MOwx","99099596701516878320","","","storm","ISCRAM2013","2011","2011 Joplin tornado",""
"True","How we dress for the tornado shelter http://instagr.am/p/ErlFG/","99697155246874408098","","","storm","ISCRAM2013","2011","2011 Joplin tornado",""
"True","Tornado Warning for Denton & SE Wise Co. til 8:15p  Tornado detected near Rhome moving East at 40 mph.","99433450565381495316","","","storm","ISCRAM2013","2011","2011 Joplin tornado",""
"True","There is now a Tornado 3 miles SE of Springtown with debris on the ground!  Get to your storm shelter immediately!","99880668040248261239","","","storm","ISCRAM2013","2011","2011 Joplin tornado",""
"True","Under tornado warning in Texas. Go away!!!!","99746984577160948218","","","storm","ISCRAM2013","2011","2011 Joplin tornado",""
"True","#Joplin #severe threat accelerated!    2 hours from now.   RIGHT NOW Damaging winds and hail appear to be biggest threat.","99926026622537687700","","","storm","ISCRAM2013","2011","2011 Joplin tornado",""
"True","We've raised $25000 in donations tonight for #Joplin. Our viewers are so generous. It feels great to help those in need.","99213023711951333538","","","storm","ISCRAM2013","2011","2011 Joplin tornado",""
"True","We've raised $25000 in donations tonight for #Joplin. Our viewers are so generous. It feels great to help those in need.","99127795686293921019","","","storm","ISCRAM2013","2011","2011 Joplin tornado",""
"True","The Lord got it going down in oklahoma baby running from one tornado to another one no worry... http://bit.ly/jWYgAw","99212440772053982042","","","storm","ISCRAM2013","2011","2011 Joplin tornado",""
"True","Possible debris ball on radar near Little #Oklahoma. This cell looks very dangerous. Okemah OK seek shelter! #OKWX","99339614489795796093","","","storm","ISCRAM2013","2011","2011 Joplin tornado",""
"True","Tornado outbreak in progress north and NW of Dallas. Everyone in the Metroplex needs to be listening to the weather rig ...","99761479106377967263","","","storm","ISCRAM2013","2011","2011 Joplin tornado",""
"True","El Reno Mesonet site records a wind gust of 151 mph late this afternoon!  That's a record for the Mesonet. #okwx","99087292504187707555","","","storm","ISCRAM2013","2011","2011 Joplin tornado",""
