"relevant","tweet_text","tweet_id","humanitarian_label","original_humanitarian_label","event_type","dataset","year","event_name","original_relevant_label"
"True","Ugh my Mum is totally freaking about the weather shes packing stuff and moving it into the shelter #tornado","99793199928549523767","","","storm","ISCRAM2013","2011","2011 Joplin tornado",""
"True","Watching the OK tornado coverage on @BreakingNews CNN. Looks very scary.","99131976422101007918","","","storm","ISCRAM2013","2011","2011 Joplin tornado",""
"True","Tornado sirens please decide whether you will be off or on thank you.","99195742143827710924","","","storm","ISCRAM2013","2011","2011 Joplin tornado",""
"True","Ardmore Oklahoma GET UNDER GROUND NOW! v 4Warn http://is.gd/wkx7bt #tornado #OKWX BIG CIRCULATION!! #OK","99620752319160244296","","","storm","ISCRAM2013","2011","2011 Joplin tornado",""
"True","Another deadly tornado in Oklahoma!!????!?!?! This shit is cray cray!","99043093461275796656","","","storm","ISCRAM2013","2011","2011 Joplin tornado",""
"True","@Sassycas I've been in these Tornado's all day. Watched 3 different one's level stuff. Unbelievable damage! Houses are no match for these!","99758354620723374167","","","storm","ISCRAM2013","2011","2011 Joplin tornado",""
"True","@DrewAnderssen cuz stay safe tonight #Tulsa #KRMG storm center #tornado","99487078251744049191","","","storm","ISCRAM2013","2011","2011 Joplin tornado",""
"True","@ralphmacchio @Karina_Smirnoff I wanted to watch but our channels have taken everything off to show weather as we are in tornado alley.","99593477668572999559","","","storm","ISCRAM2013","2011","2011 Joplin tornado",""
"True","@whoremoanss_ Tornado warning. be careful dorothy.","99485578981903616951","","","storm","ISCRAM2013","2011","2011 Joplin tornado",""
"True","@FOX23 tornado sirens going off in Sapulpa.","99023522218470351525","","","storm","ISCRAM2013","2011","2011 Joplin tornado",""
"True","I'm not sure any amount of warning can prepare for an EF5. :( RT @SamChampion: Average tornado warning is about 15 ... http://tmi.me/aBIS0","99541527114804516262","","","storm","ISCRAM2013","2011","2011 Joplin tornado",""
"True","@lympha13 Same here like storms hate tornado weather! @KarenDeLabar  @literarygrrrl @glennrogers42","99025636877063583350","","","storm","ISCRAM2013","2011","2011 Joplin tornado",""
"True","@jenniferLopez17 Actor @paulwalker47 's charity #ROWW.org needs #Donations so that they can deploy a team to #Joplin. Plz RT #HelpJoplin","99364916179642029245","","","storm","ISCRAM2013","2011","2011 Joplin tornado",""
"True","@MorganWoolard Tornado on path along I-40. Strormchasers picked it up in OKC. Has cut 18 wheeers in half","99657572864873163064","","","storm","ISCRAM2013","2011","2011 Joplin tornado",""
"True","Lost @directv. Radio says tornado is over the city of Bartlesville now.","99371726530632138913","","","storm","ISCRAM2013","2011","2011 Joplin tornado",""
"True","@derekcody No idea... Lots of roads closed but most of the damage was cosmetic instead of structural in Moore. Definitely a tornado though.","99112670025563890835","","","storm","ISCRAM2013","2011","2011 Joplin tornado",""
"True","Three small children missing in a Oklahoma town. They got separated from their family as the tornado c ...","99563039159068818789","","","storm","ISCRAM2013","2011","2011 Joplin tornado",""
"True","Tornado warnings&lt;Disney channel","99796511920380006537","","","storm","ISCRAM2013","2011","2011 Joplin tornado",""
"True","Tornado in El Reno Ok minutes ago: http://youtu.be/roX4msxfs_w  #OKw","99237396129683347466","","","storm","ISCRAM2013","2011","2011 Joplin tornado",""
"True","Video: TV crew captures huge tornado http://goo.gl/fb/rMO2n","99572692306491209381","","","storm","ISCRAM2013","2011","2011 Joplin tornado",""
"True","just heard on the news a boy was sucked out of a car by a Tornado in OK and father seriously injured.  This is insane","99935546425867333651","","","storm","ISCRAM2013","2011","2011 Joplin tornado",""
"True","Man tornado/storm warnings go from Texas Oklahoma Kansas Missouri Nebraska an Colorado","99769445468832841187","","","storm","ISCRAM2013","2011","2011 Joplin tornado",""
"True","@lartist We're having a huge tornado outbreak in Oklahoma USA. Please RT that people can donate supplies money to @redcrossokc!","99192108103287443029","","","storm","ISCRAM2013","2011","2011 Joplin tornado",""
"True","Ugh RT @dawnerscott: AP:  #Joplin death toll now 122 more than 750 injured. Tornado that hit was an EF5 w/winds greater than 200mph #MOwx","99345324083432741891","","","storm","ISCRAM2013","2011","2011 Joplin tornado",""
"True","#KCChasers will be live following the tornado watch coming to KC #KCStorms","99232611857211137396","","","storm","ISCRAM2013","2011","2011 Joplin tornado",""
"True","Another tornado watch? I think southwestern Missouri has had enough destruction! #prayingforsafety","99732617282759965246","","","storm","ISCRAM2013","2011","2011 Joplin tornado",""
"True","Yikes!!! Tornado on the way in Fort Worth....be careful @sjp_73 and @PricklyPear91","99086839410267693824","","","storm","ISCRAM2013","2011","2011 Joplin tornado",""
"True","@JacquiJeras: tornado warning for Payne and Noble coutnies OK. Storm has history of large destructive tornado. // RUN!!!!","99980368697428487395","","","storm","ISCRAM2013","2011","2011 Joplin tornado",""
"True","Mo. tornado single deadliest in US since 1950 - Seattle Post Intelligencer http://tinyurl.com/43g7w8g","99246817556460759859","","","storm","ISCRAM2013","2011","2011 Joplin tornado",""
"True","@mia423 i am hearing tornado sirens","99305703017310593624","","","storm","ISCRAM2013","2011","2011 Joplin tornado",""
"False","Weiner Blasts GOP proposal over not allowing money for Tornado victims","99342786923555390436","","","storm","ISCRAM2013","2011","2011 Joplin tornado",""
"True","Tornado sirens ..","99661224341350434617","","","storm","ISCRAM2013","2011","2011 Joplin tornado",""
"True","Damage reports at a church on Frank Phillips and Virginia and also damage at the hospital. #oklahoma #tornado #Bartlesville","99927644123696677808","","","storm","ISCRAM2013","2011","2011 Joplin tornado",""
"True","7:31 Bartlesville is now under a tornado warning","99720082818974329295","","","storm","ISCRAM2013","2011","2011 Joplin tornado",""
"True","Mesoscale discussion posted for parts of western MO. Tornado watch will likely be issued soon.","99827459646498966643","","","storm","ISCRAM2013","2011","2011 Joplin tornado",""
"False","Midnight Tornado has a show coming up on 2011-05-26 at 19:00 @ Medkom Gathering in Bandung http://soc.li/6fl5Y0d","99666611432277451168","","","storm","ISCRAM2013","2011","2011 Joplin tornado",""
"True","Pea to quarter size hail in #Keller. #txwx","99682373490883458626","","","storm","ISCRAM2013","2011","2011 Joplin tornado",""
"True","Tornado Watch was issued for western and central Missouri including Joplin. Not what you want to hear.","99315168309399717114","","","storm","ISCRAM2013","2011","2011 Joplin tornado",""
"True","@txstormchasers:  #Tornado outbreak beginning in North Texas. #txwx Look out @Rangers","99653047359579133835","","","storm","ISCRAM2013","2011","2011 Joplin tornado",""
"True","All day collection of tornado relief supplies set for Thurs @zarco66 on 23rd St #Lawrence 7a-7p. http://bit.ly/mbWCzD?","99612274709909373197","","","storm","ISCRAM2013","2011","2011 Joplin tornado",""
"True","Hmm so maybe we're in the direct path of the storm/tornado.","99492419570190725144","","","storm","ISCRAM2013","2011","2011 Joplin tornado",""
"True","Paying for missouri. Tornado watch has been initiated.","99400428640949598012","","","storm","ISCRAM2013","2011","2011 Joplin tornado",""
"True","Beauty after Darkness! http://t.co/f91OBJ1","99088384799666853186","","","storm","ISCRAM2013","2011","2011 Joplin tornado",""
"True","My dad just called ne n said 6 ppl died from a tornado in the city. Tryna make it Home #prayforme","99949706353860615642","","","storm","ISCRAM2013","2011","2011 Joplin tornado",""
"True","Oh dear... #Joplin is under a #Tornado Watch... #MOwx","99581809765999827077","","","storm","ISCRAM2013","2011","2011 Joplin tornado",""
"True","Rain and thunder beginning in South Tulsa. #okwx","99345771564003442590","","","storm","ISCRAM2013","2011","2011 Joplin tornado",""
"True","Tornado two miles south of Stillwater OK! We were 0.3 miles from it!  http://t.co/DqtlSJY","99764913490930645182","","","storm","ISCRAM2013","2011","2011 Joplin tornado",""
"True","Tornado Jus Touch Down On 58 #WhereDidThisComeFrom Man Its Hectic!","99361271373990592809","","","storm","ISCRAM2013","2011","2011 Joplin tornado",""
"True","please pray for the tornado victims.. PLEASE..","99477671810955493065","","","storm","ISCRAM2013","2011","2011 Joplin tornado",""
"True","Is that Hwy 177? Where exactly? RT @mamber08 Tornado two miles south of Stillwater OK! We were 0.3 miles from it! yfrog.com/h8al3obj","99289688579406115349","","","storm","ISCRAM2013","2011","2011 Joplin tornado",""
"True","Joplin death toll now 122 winds were 200+ mph  Sadly toll likely to rise and more deaths in Oklahoma tonight worst tornado toll in lifetime","99594180269632496103","","","storm","ISCRAM2013","2011","2011 Joplin tornado",""
"True","Watching the tornado show on weather channel. Oklahoma is pretty well screwed. Doesn't look good Joplin and softball sized hail in Texas.","99774256247477553714","","","storm","ISCRAM2013","2011","2011 Joplin tornado",""
"True","please pray for the tornado victims.. PLEASE..","99631296570145436386","","","storm","ISCRAM2013","2011","2011 Joplin tornado",""
"True","SPC Tornado Watch 358 Status Reports http://dlvr.it/StNQ3","99723854770032553965","","","storm","ISCRAM2013","2011","2011 Joplin tornado",""
"True","The only thing left standing is the cross -a doctor from #Joplin on CNN.  My prayer is that the cross will be a refuge in their hearts.","99595165883359136495","","","storm","ISCRAM2013","2011","2011 Joplin tornado",""
"True","S/o to @TheRealZeli for tweeting during a tornado. Stay safe bro! #thrwdgngbtch","99215064752976202945","","","storm","ISCRAM2013","2011","2011 Joplin tornado",""
"True","Oklahoma under seige tonight from tornado's!!!!!","99575542606737178778","","","storm","ISCRAM2013","2011","2011 Joplin tornado",""
"True","Three small children missing in a Oklahoma town. They got separated from their family as the tornado came thru the town.","99761857689474306873","","","storm","ISCRAM2013","2011","2011 Joplin tornado",""
"True","Get to Shelter!! T @blinke: RT @DFWscanner: Tornado ON THE GROUND with debris near Azle. @wfaaweather @wfaaweathertoo","99949901252220505568","","","storm","ISCRAM2013","2011","2011 Joplin tornado",""
"True","Get to Shelter!! T @blinke: RT @DFWscanner: Tornado ON THE GROUND with debris near Azle. @wfaaweather @wfaaweathertoo","99308909116680612479","","","storm","ISCRAM2013","2011","2011 Joplin tornado",""
"True","#inhighschool we all are scared of tornados but hope for just a second that if a tornado does come it hits the school.","99735479021359982793","","","storm","ISCRAM2013","2011","2011 Joplin tornado",""
"True","Tornado warning for the storms approachg Dallas-Fort Worth Metro.  #TXWX","99932636800401296214","","","storm","ISCRAM2013","2011","2011 Joplin tornado",""
"True","Possible #tornado on the ground S of Agnes #Texas. Springtown Texas ** SEEK SHELTER NOW! ** #TXWX Follow 4 updates.","99983182226454398859","","","storm","ISCRAM2013","2011","2011 Joplin tornado",""
"True","Three small children missing in a Oklahoma town. They got separated from their family as the tornado came through the ...","99837730139405877715","","","storm","ISCRAM2013","2011","2011 Joplin tornado",""
"True","Chiefs gathering aid for tornado victims - http://www.carthagepress.com/newsnow/x157801704/Chiefs-gathering-aid-for-tornado-victims","99069038853196037719","","","storm","ISCRAM2013","2011","2011 Joplin tornado",""
"True","That's just bad luck.  RT @cnnbrk Joplin Missouri where at least 124 died Sunday under #tornado watch http://on.cnn.com/k1ZN2b","99231331424751547818","","","storm","ISCRAM2013","2011","2011 Joplin tornado",""
"True","Storms will be moving into #Joplin #Missouri in the next couple hours. My heart goes out to residents of that area. #M ...","99533210845514111685","","","storm","ISCRAM2013","2011","2011 Joplin tornado",""
"True","Weather service issues #tornado watch for western Missouri extreme eastern Kansas http://on.cnn.com/k1ZN2b","99277132292962551760","","","storm","ISCRAM2013","2011","2011 Joplin tornado",""
"True","TORNADO WARNING: Coal (Oklahoma)  Expires: 05/24/2011 08:30PM (CDT) http://bit.ly/lkecUP #tornado #okwx #okstorms","99860579251966271532","","","storm","ISCRAM2013","2011","2011 Joplin tornado",""
"True","New tornado watch until 3am CDT for western MO.  Includes #Joplin.  More info: http://wxch.nl/k6CgxX","99882596094141284708","","","storm","ISCRAM2013","2011","2011 Joplin tornado",""
"False","Al menos 122 muertos y 750 heridos por tornado en EU http://bit.ly/kPs5Kk http://fb.me/BtjlRG2m","99973206403350978011","","","storm","ISCRAM2013","2011","2011 Joplin tornado",""
"True","Medical examiner: 4 dead in Oklahoma tornadoes: A broad tornado has blown through the Oklahoma City metropolita... http://usat.ly/ivMg9V","99472997882525754290","","","storm","ISCRAM2013","2011","2011 Joplin tornado",""
"True","@SoonerMike88 oh no. RT @JimCantore: MSNBC is reporting 7 dead in OK tonight! #tornado #okwx","99991726877935878445","","","storm","ISCRAM2013","2011","2011 Joplin tornado",""
"True","Weather service issues #tornado watch for western Missouri extreme eastern Kansas http://on.cnn.com/k1ZN2b","99730868632212361868","","","storm","ISCRAM2013","2011","2011 Joplin tornado",""
"True","@npbat I have not heard of deaths in this OK City tornado(s) thus far from local OKC TV but several deaths in Joplin MO couple days ago...","99975333528438595882","","","storm","ISCRAM2013","2011","2011 Joplin tornado",""
"True","Tornado in Denton County TX now reported to be near Lantana. Warning info and radar: http://wxch.nl/laelgs","99307754818214399953","","","storm","ISCRAM2013","2011","2011 Joplin tornado",""
"True","Those in Guthrie OK need to TAKE COVER NOW.  LARGE VIOLENT #TORNADO HEADED TOWARD THAT AREA!!!  PLEASE RETWEET!!!","99330939890963231869","","","storm","ISCRAM2013","2011","2011 Joplin tornado",""
"True","7 already dead from Oklahoma tornado...so sad. Praying @GroganontheGO is staying safe!","99185141105009036602","","","storm","ISCRAM2013","2011","2011 Joplin tornado",""
"True","@kelsey_layne NWA is under a moderate risk overnight. It's a possibility not a large one that the tornado watches are PDS watches","99791889784621923472","","","storm","ISCRAM2013","2011","2011 Joplin tornado",""
"True","Another tornado watch issued for Joplin.  God be with them.","99272239163223989181","","","storm","ISCRAM2013","2011","2011 Joplin tornado",""
"True","More details on the wx station in El Reno OK that survived a direct hit from a tornado and got 151 mph gust - http://is ...","99274952671182902426","","","storm","ISCRAM2013","2011","2011 Joplin tornado",""
"True","Ready to see this Tornado! #bringitbitchh #dyingperhaps","99172894703557160143","","","storm","ISCRAM2013","2011","2011 Joplin tornado",""
"True","Crap! North Texas is at risk. #tornado","99031940740596721763","","","storm","ISCRAM2013","2011","2011 Joplin tornado",""
"True","#asktaylor @taylorswift13 will you please!!! visit me and my friends in joplin missouri. we need a lot of hope after ...","99918930038108111758","","","storm","ISCRAM2013","2011","2011 Joplin tornado",""
"True","Radar indicates a possible tornado between Poolville and Peaster.","99358028902549243043","","","storm","ISCRAM2013","2011","2011 Joplin tornado",""
"True","Joplin Missouri where at least 124 died Sunday under #tornado watch http://on.cnn.com/k1ZN2b","99559607753599036310","","","storm","ISCRAM2013","2011","2011 Joplin tornado",""
"True","Cantor/GOP say no aid 2 tornado victims!! really! R these the ppl U want 2 run our country?? http:/ ...","99486554925323937820","","","storm","ISCRAM2013","2011","2011 Joplin tornado",""
"True","This tornado better end soon. I'm not gonna be happy if I miss #thevoice!","99232879200031806368","","","storm","ISCRAM2013","2011","2011 Joplin tornado",""
"True","Important: @Redross & #Joplin MO needs your help! Txt REDCROSS to 90999 to donate or online help at http://bit.ly/eZJDoJ * RT RT *","99314415486769805258","","","storm","ISCRAM2013","2011","2011 Joplin tornado",""
"True","Wise and Denton under TORNADO WARNING until 8:15. Tarrant your next","99033598288497024549","","","storm","ISCRAM2013","2011","2011 Joplin tornado",""
"True","Tornado Warning for Rice County in KS until 8:00pm CDT. #kswx #btcprayers","99910427334356913060","","","storm","ISCRAM2013","2011","2011 Joplin tornado",""
"True","We are now under a tornado watch here until 3 am & Joplin & Kanakuk Kamps are also included. Lots of Godly college kids there. @franthomas","99320249300665019819","","","storm","ISCRAM2013","2011","2011 Joplin tornado",""
"True","Time running out for tornado survivors: RESCUERS combed through overturned cars and flattened buildings hunting ... ...","99634920925092816095","","","storm","ISCRAM2013","2011","2011 Joplin tornado",""
"True","@HulkHogan4Real I hate to ask Hulk but as a life long fan any chance we can get you to donate to the efforts in #Joplin MO","99742820195236404765","","","storm","ISCRAM2013","2011","2011 Joplin tornado",""
"True","Tornado on the ground Kellyville okla worst track possible for our house!!!!! 30 miles out","99048690604787290458","","","storm","ISCRAM2013","2011","2011 Joplin tornado",""
"True","15 minutes left to donate to tornado relief and get a copy of my debut novel ASHFALL 5 months early: http://goo.gl/zW5hE.","99832955812517952716","","","storm","ISCRAM2013","2011","2011 Joplin tornado",""
"True","Get to Shelter!! T @blinke: RT @DFWscanner: Tornado ON THE GROUND with debris near Azle. @wfaaweather @wfaaweathertoo","99901854112459531161","","","storm","ISCRAM2013","2011","2011 Joplin tornado",""
"True","KXII storm chaser Doug Drace confirms a large tornado on the ground 4-5 mi north of Ravia on Highway 1. Take precautions imm ...","99063787999667207501","","","storm","ISCRAM2013","2011","2011 Joplin tornado",""
"True","NBC5 has a debris ball. This is a life-threatening situation for people in Northern Tarrant. Be calm but act quickly. #txwx","99361907559767762963","","","storm","ISCRAM2013","2011","2011 Joplin tornado",""
"True","No sooner do I post that than the #Oklahoma #tornado death toll rises to at least 7.  KNX1070","99343546598275576026","","","storm","ISCRAM2013","2011","2011 Joplin tornado",""
"True","Just told we r all clear 4 another hour in #Tulsabut not over yet #tornado #oklahoma","99073304705941305417","","","storm","ISCRAM2013","2011","2011 Joplin tornado",""
"True","Tornado season in the mid west is awful!  Mother Nature is a fickle lady...","99774385173420181203","","","storm","ISCRAM2013","2011","2011 Joplin tornado",""
"True","Joplin is under a Tornado Warning until 3 Am","99457588835465711656","","","storm","ISCRAM2013","2011","2011 Joplin tornado",""
"True","MSNBC's anchor and meteorologist said this is an unprecedented outbreak in the heart of Tornado Alley...and toss to L ...","99968235552697684724","","","storm","ISCRAM2013","2011","2011 Joplin tornado",""
"True","@Chosler88 the Tuscaloosa tornado on April 27 missed my apartment by a block and my store by 4 blocks. Glad you are safe.","99971624908019166662","","","storm","ISCRAM2013","2011","2011 Joplin tornado",""
"True","Joplin under a tornado watch. Hey mother nature """"""""Too Soon"""""""" !","99272136923843903519","","","storm","ISCRAM2013","2011","2011 Joplin tornado",""
"True","That is now the 51st killer tornado of 2011.  #ALWX","99658287486160050546","","","storm","ISCRAM2013","2011","2011 Joplin tornado",""
"True","Corral City police report tornado at I35W and FM 407. Again take shelter.","99576747285611210859","","","storm","ISCRAM2013","2011","2011 Joplin tornado",""
"True","Charice Sunshine Corazon Glee American Idol Tornado Oklahoma ... #NextTrendingTopic","99139091467620899721","","","storm","ISCRAM2013","2011","2011 Joplin tornado",""
"True","Have mercy Lord have mercy. RT @cnnbrk Joplin Missouri where at least 124 died Sunday under #tornado watch http://on.cnn.com/k1ZN2b","99765790218692264635","","","storm","ISCRAM2013","2011","2011 Joplin tornado",""
"True","Tornado sires are sounding in #Bartlesvill #Oklahoma. Be prepared.","99669178396726010653","","","storm","ISCRAM2013","2011","2011 Joplin tornado",""
"True","Tornado watch In Joplin and KC til 3am hang tough KC and Joplin!!!","99893647741914045989","","","storm","ISCRAM2013","2011","2011 Joplin tornado",""
"True","Obama to tornado victims: """"We are here for you see you on Sunday.""""","99605583714062855654","","","storm","ISCRAM2013","2011","2011 Joplin tornado",""
"True","Tornado warning for N. Tarrant County TX (northern Fort Worth area).  Softball size hail possible too. Warning info: h ...","99572369148495429153","","","storm","ISCRAM2013","2011","2011 Joplin tornado",""
"True","@ThePCreamer hope so. Tornado warnings around Dallas right now.","99104049769842923466","","","storm","ISCRAM2013","2011","2011 Joplin tornado",""
"True","Make that a tornado warning until 9:15","99691546897398274782","","","storm","ISCRAM2013","2011","2011 Joplin tornado",""
"True","Tornado Warning for Mitchell County in KS until 8:15pm CDT. #kswx","99891428395614570702","","","storm","ISCRAM2013","2011","2011 Joplin tornado",""
"True","Tornado in springotwn. Stay safe familia& friends","99361337509042654759","","","storm","ISCRAM2013","2011","2011 Joplin tornado",""
"True","Watching severe weather is much more than informative -- fact there's a guilty pleasure taken in tornado outbreaks","99959615954424960209","","","storm","ISCRAM2013","2011","2011 Joplin tornado",""
"True","@pgwphd Watching tornado reports?","99849975649590732581","","","storm","ISCRAM2013","2011","2011 Joplin tornado",""
"True","@DominicCervi Paddy once out-span a tornado. The Wizard of Oz just watched in awe. #PaddyFacts","99929072118666350222","","","storm","ISCRAM2013","2011","2011 Joplin tornado",""
"True","Thank you mid-Missouri! We just hit $110000 for Red Cross Joplin relief. Call 573 644 6440. #Joplin #Telethon","99857726301033034755","","","storm","ISCRAM2013","2011","2011 Joplin tornado",""
"True","Good Lookin RT @Mr1738: CNN RT @CBazzTheGreat: Where yall seeing this tornado shit at?","99251346556039537811","","","storm","ISCRAM2013","2011","2011 Joplin tornado",""
"False","Pray for people of #Joplin. Great to see people helping each other in this country & focusing on people instead of money #GovtPayAttention","99123148171968734631","","","storm","ISCRAM2013","2011","2011 Joplin tornado",""
"True","FHTM is collecting donations for Alabama tornado victims.  If you would like to help you can donate through this chu ...","99246850450066172127","","","storm","ISCRAM2013","2011","2011 Joplin tornado",""
"True","@Maggie4Obama #tornado watch past midnight for #LA #tx #ks #mo #tn //Senators Congressmen/women bsure 2 vote w/Cantor on #nofunds4tornadoes","99316531526148614057","","","storm","ISCRAM2013","2011","2011 Joplin tornado",""
"True","please pray for the tornado victims.. PLEASE..","99470824964098979325","","","storm","ISCRAM2013","2011","2011 Joplin tornado",""
"True","Shoes will be on the way to #Joplin this weekend via our partners @crosspoint_tv @Soles4Souls @cp ...","99994855885888696667","","","storm","ISCRAM2013","2011","2011 Joplin tornado",""
"True","@PaulaInTulsaOK Be Safe!  #Tulsa #tornado #oklahoma","99064477597767579938","","","storm","ISCRAM2013","2011","2011 Joplin tornado",""
"True","Right on Eric Cantor!  The reason we have a huge budget deficit is all our crazy spending on tornado relief.","99615049004044526546","","","storm","ISCRAM2013","2011","2011 Joplin tornado",""
"True","Thinking of everyone who is hurting right now because of the tornado. You're not alone- praying for you!","99806604321611098734","","","storm","ISCRAM2013","2011","2011 Joplin tornado",""
"True","Just stop!!! :( RT: @cnnbrk: Joplin Missouri where at least 124 died Sunday under #tornado watch http://t.co/hEbTeMu","99130235571541817240","","","storm","ISCRAM2013","2011","2011 Joplin tornado",""
"True","come on @weatherninja @KATV_Weather @Paul_The_Wxguru.  Seal the freakin deal!!!!  #arwx #mowx #tornado","99629201182531091509","","","storm","ISCRAM2013","2011","2011 Joplin tornado",""
"True","@weathertrek Possible #tornado on the ground S of Agnes #Texas. Springtown ** SEEK SHELTER NOW! ** #TXWX Follow 4 up ...","99547469527307054775","","","storm","ISCRAM2013","2011","2011 Joplin tornado",""
"True","Tornado warning in Dallas/DFW- everyone stay safe tonight","99284018390556209767","","","storm","ISCRAM2013","2011","2011 Joplin tornado",""
"True","LORD have mercy on ""Tornado Alley"".","99320205230691833238","","","storm","ISCRAM2013","2011","2011 Joplin tornado",""
"True","Cantor should be forced to fucking resign from congress for holding tornado aid hostage in way convict Tom DeLay even would condemn. #p2","99904205497075404405","","","storm","ISCRAM2013","2011","2011 Joplin tornado",""
"True","California's weather sunny and rainy as I remembered. Oklahoma's thundstorm tornado snow sleet hail and a little sunny. =)","99167071620498549383","","","storm","ISCRAM2013","2011","2011 Joplin tornado",""
"True","So basically the month of May should be one ginormous tornado warning in Oklahoma.","99547893405958369303","","","storm","ISCRAM2013","2011","2011 Joplin tornado",""
