"relevant","tweet_text","tweet_id","humanitarian_label","original_humanitarian_label","event_type","dataset","year","event_name","original_relevant_label"
""," @breakingweather: Reports of a possible #tornado and numerous trees down 2-miles north of Springboro, Pennsylvania at 4:55 p.m. EDT.","73864370379165600","Caution and advice","","storm","ISCRAM2013","2011","2011 Joplin tornado","Caution and advice"
"","Stewart County hit by tornado, weather service reports http://twurl.nl/dphwl6 http://twurl.nl/jjaa","73311281733574496","Caution and advice","","storm","ISCRAM2013","2011","2011 Joplin tornado","Caution and advice"
""," @OKWXTracker: A SEVERE THUNDERSTORM WATCH IS IN EFFECT UNTIL 11:00 PM SATURDAY FOR PAS OF OKLAHOMA, http://tinyurl.com/23uk4o5 #okw ...","79649358072655808","Caution and advice","","storm","ISCRAM2013","2011","2011 Joplin tornado","Caution and advice"
"","Live updates: Western Mass. tornado recovery effort underway Thursday: Continually-updated news and information ... http://bit.ly/ktFECZ","76252101860270000","Information source","","storm","ISCRAM2013","2011","2011 Joplin tornado","Information source"
""," @Weatherbird:  @FOX23Michelle: Two children found alive in Joplin!!!  A 9-yr-old and 7-yr-old found in their house!!! #Joplin","73809221174566800","People missing, found or seen","","storm","ISCRAM2013","2011","2011 Joplin tornado","People missing, found or seen"
"","National Weather Service issues TORNADO WARNING for Texas County, OK and Beaver County, OK until 7:30pm.","79700544578535296","Caution and advice","","storm","ISCRAM2013","2011","2011 Joplin tornado","Caution and advice"
"","http://twitpic.com/52e998  possible tornado forming by work heading towards @tjmlnarik .  Duck and cover.","73424411637727200","Caution and advice","","storm","ISCRAM2013","2011","2011 Joplin tornado","Caution and advice"
""," @TeaPartyTrthSqd:  @FrankConniff ""After saying he'd withhold tornado relief funds, National Weather Service upgraded @EricCantor to ...","73256988729028608","Unknown","","storm","ISCRAM2013","2011","2011 Joplin tornado","Unknown"
"","Dog crawls home with 2 broken legs. http://www.bing.com/videos/watch/video/lost-in-tornado-dog-crawls-home-with-two-broken-legs/6b2d25o","75184953083695104","Information source","","storm","ISCRAM2013","2011","2011 Joplin tornado","Information source"
"","Makeover Happy Hour feat. fab @janeiredale mineral makeup to benefit tornado victims! Spread the word! http://bit.ly/mveVsS #DCevents","74186040608436096","Donations of money, goods or services","","storm","ISCRAM2013","2011","2011 Joplin tornado","Donations of money, goods or services"
"","Tornado watch extended until 11pm hope everyone is home or in a safe spot.","76071959334621104","Caution and advice","","storm","ISCRAM2013","2011","2011 Joplin tornado","Caution and advice"
"","NOAA Movie of Joplin Tornado in 3-D Radar Data http://ow.ly/5cdvP","78141220827824000","Information source","","storm","ISCRAM2013","2011","2011 Joplin tornado","Information source"
""," @RedCross: You can help us respond in #Joplin &continue our work in other states. Txt REDCROSS to 90999, or online: http://bit.ly/eZJDoJ","72769152108072800","Donations of money, goods or services","","storm","ISCRAM2013","2011","2011 Joplin tornado","Donations of money, goods or services"
""," @cnnbrk: Rangers Ballpark in Arlington, TX, evacuated mid-game amid #tornado warning http://on.cnn.com/k1ZN2b","73218971066843104","Caution and advice","","storm","ISCRAM2013","2011","2011 Joplin tornado","Caution and advice"
""," @brianstelter: If you're just waking up: the NYT's main story out of #Joplin: http://t.co/mkWKgSS & my sidebar about 1 family: http:/ ...","72998517563600800","Information source","","storm","ISCRAM2013","2011","2011 Joplin tornado","Information source"
"","@Christin612 come on now-- the first 4 minutes of the news was spent on the tornado - plus stories at 5 + 6. There's time for other stuff!","73371428308787200","Unknown","","storm","ISCRAM2013","2011","2011 Joplin tornado","Unknown"
"","The tornado hunt ended friday. Good!","77153643601735600","Unknown","","storm","ISCRAM2013","2011","2011 Joplin tornado","Unknown"
"","Tolliver on coach, Rubio, labor issues and Joplin tornado | StarTribune.com http://t.co/WyEZXoB","78200930515951600","Information source","","storm","ISCRAM2013","2011","2011 Joplin tornado","Information source"
"","TORNADO WARNING: Kalamazoo (Michigan)  Expires: 05/29/2011 03:45PM (CDT) http://bit.ly/mU0aeM #tornado #miwx","74928299909980000","Caution and advice","","storm","ISCRAM2013","2011","2011 Joplin tornado","Caution and advice"
"","Chance of a tornado: 52% -_____-","73508448788156400","Caution and advice","","storm","ISCRAM2013","2011","2011 Joplin tornado","Caution and advice"
"","Possible tornado on the ground 1 mile north of Vicksburg...no visual.  NWS radar returns showing visual.","74933011984039904","Caution and advice","","storm","ISCRAM2013","2011","2011 Joplin tornado","Caution and advice"
"","Tornado watch for Monroe county michigan until 8 pm tonight.","74948884203442000","Caution and advice","","storm","ISCRAM2013","2011","2011 Joplin tornado","Caution and advice"
"","Cardinals, Royals 'Unite for Joplin' tornado victims in upcoming series - ky3.com http://t.co/cIrib7u","78572553198768000","Donations of money, goods or services","","storm","ISCRAM2013","2011","2011 Joplin tornado","Donations of money, goods or services"
""," @TWCBreaking: Spotters confirm at least 1/2 mi. wide #tornado near Longdale, OK.  TAKE COVER in Fairview, Orienta.  Radar:  http://wx ...","73125845379727200","Information source","","storm","ISCRAM2013","2011","2011 Joplin tornado","Information source"
"","#United States #Pennsylvania #WeatherlyWeather service confirms tornado touched down in Embden, Maine - Bangor Daily News","76514394246360896","Caution and advice","","storm","ISCRAM2013","2011","2011 Joplin tornado","Caution and advice"
""," @socialcap: Help #MA tornado victims: drop vital supplies off @ your local firestation. Details @BostonChannel post http://bit.ly/jgMlAb","77754686245052400","Donations of money, goods or services","","storm","ISCRAM2013","2011","2011 Joplin tornado","Donations of money, goods or services"
""," @eyokley: Hospital officials are asking all doctors and nurses from regional hospitals to report to the front door of Freeman West.   ...","72682396750848000","Donations of money, goods or services","","storm","ISCRAM2013","2011","2011 Joplin tornado","Donations of money, goods or services"
""," @weatherchannel: 3 OK tornadoes have been upgraded to EF4:  1) El Reno/Piedmont....2) Chickasha to Newcastle/Moore....3) Washington/G ...","74122869088587600","Caution and advice","","storm","ISCRAM2013","2011","2011 Joplin tornado","Caution and advice"
""," @EnewsWorld: Obama to attend Joplin memorial service: US President Barack Obama is set to inspect tornado damage in Joplin, M... ht ...","74912448557236096","Information source","","storm","ISCRAM2013","2011","2011 Joplin tornado","Information source"
""," @SamsClubSusan: #samsclub in #Joplin is open. Additional supplies arriving. No membership required. Follow 4 updates #Tornado #Mo","72761628894035904","Information source","","storm","ISCRAM2013","2011","2011 Joplin tornado","Information source"
""," @TeriChristoph: This blogger has put together a great list of ways to help the residents of #Joplin -&gt; http://bit.ly/iw7Ljg","73504405273583600","Donations of money, goods or services","","storm","ISCRAM2013","2011","2011 Joplin tornado","Donations of money, goods or services"
"","Pretty cool story about a dog with two broken legs crawling back home after a tornado carried him away. http://fb.me/xEP9YjCk","75529091285135200","Information source","","storm","ISCRAM2013","2011","2011 Joplin tornado","Information source"
"","#Tornado watch=a tornado is possible in the area. Tornado warning=one has been sighted or indicated, take shelter. @fema #kswx #ksstorms","73179037735985104","Caution and advice","","storm","ISCRAM2013","2011","2011 Joplin tornado","Caution and advice"
""," @Dargamogirl: @ChavezChavis @maddow Cantor is a disgrace. Says find $ elsewhere B4 givin to tornado vics. That moron shld resign. #do ...","78298474944274400","Donations of money, goods or services","","storm","ISCRAM2013","2011","2011 Joplin tornado","Donations of money, goods or services"
""," @divephantom19: http://bit.ly/kvo191  How couponers can help Tornado Victims-pass it along!","73210203616722800","Donations of money, goods or services","","storm","ISCRAM2013","2011","2011 Joplin tornado","Donations of money, goods or services"
"","Death toll from Joplin tornado rises to 141: officials - Reuters http://reut.rs/jw1E4Z","77720662453649408","Casualties and damage","","storm","ISCRAM2013","2011","2011 Joplin tornado","Casualties and damage"
"","TORNADO WARNING: Beaver (Oklahoma)  Expires: 06/11/2011 08:30PM (CDT) http://bit.ly/m0R1db #tornado #okwx #okstorms","79715771021918208","Caution and advice","","storm","ISCRAM2013","2011","2011 Joplin tornado","Caution and advice"
"","'Major Tornado Outbreak' Forecast for US Midwest Including Kansas City - Bloomberg http://su.pr/33cUMi","73478706374508400","Information source","","storm","ISCRAM2013","2011","2011 Joplin tornado","Information source"
""," @livewxradar: *** TORNADO WATCH *** until 2AM CDT for IA MN SD ND for LARGE TORNADOES 2.5"" HAIL and 80MPH winds","75384032078217200","Caution and advice","","storm","ISCRAM2013","2011","2011 Joplin tornado","Caution and advice"
"","Just saw the story of the dog who dragged himself home after a tornado with two broken paws. Too precious.","73880674926477200","Information source","","storm","ISCRAM2013","2011","2011 Joplin tornado","Information source"
"","Tornado watch Sunday afternoon and evening http://exm.nr/makBhi","74910194966069200","Caution and advice","","storm","ISCRAM2013","2011","2011 Joplin tornado","Caution and advice"
"","Death toll from Joplin tornado is 134, officials say (Reuters)  http://tiny.ly/dbpi","76046750871334800","Casualties and damage","","storm","ISCRAM2013","2011","2011 Joplin tornado","Casualties and damage"
""," @believeinjoplin: Help change lives in #Joplin! Visit http://www.operationbelieve.org & DL music to donate $ to St. Johns Hospital &  ...","77548497615851504","Donations of money, goods or services","","storm","ISCRAM2013","2011","2011 Joplin tornado","Donations of money, goods or services"
""," @techreview: Record Tornado Season Caused by Climate Change? http://bit.ly/irPWsI","73619013380476800","Information source","","storm","ISCRAM2013","2011","2011 Joplin tornado","Information source"
""," @breakingweather: A compilation of gripping and heartbreaking photos of the #Joplin aftermath: http://ow.ly/52GB5 #tornado","73396575631712096","Information source","","storm","ISCRAM2013","2011","2011 Joplin tornado","Information source"
"","Lost Tornado Animals TUSCALOOSA, AL: Is this your dog? Found in the North River area.  You can help this pup find hi... http://ow.ly/1cWwN4","75054347913936800","Information source","","storm","ISCRAM2013","2011","2011 Joplin tornado","Information source"
""," @savethechildren: #Tornado, Hurricane & Wildfire season is upon us. Help us protect U.S. children in harm's way: http://j.mp/m37DPS # ...","73540100151197600","Information source","","storm","ISCRAM2013","2011","2011 Joplin tornado","Information source"
"","Special Weather Statement issued June 05 at 2:45PM CDT expiring June 05 at 3:45PM CDT by NWS Shreveport ht... http://bit.ly/lQesrZ #OKwx","77468443040944000","Caution and advice","","storm","ISCRAM2013","2011","2011 Joplin tornado","Caution and advice"
""," @severestudios: NOW IN EFFECT:  Tornado Watch for portions of the area in IN, OH, MI until 8:00pm EDT / 7:00pm CDT. http://1.usa.gov/ ...","74893739901976400","Caution and advice","","storm","ISCRAM2013","2011","2011 Joplin tornado","Caution and advice"
"","ok we are under an official tornado watch until later this morning please keep us in your thoughts and prayers just came over scanner","73272572766199808","Caution and advice","","storm","ISCRAM2013","2011","2011 Joplin tornado","Caution and advice"
"","After tornado, dog crawls back to his family's home on two broken legs    http://is.gd/91NIuW  #tcot #gop #hhrs #sgp #tlot","73870491017949104","Unknown","","storm","ISCRAM2013","2011","2011 Joplin tornado","Unknown"
"","@NSSL: The research phased array radar captured a long lived tornado on May 24, 2011. Read about it here: http://t.co/0phfG4V","74151706748919808","Information source","","storm","ISCRAM2013","2011","2011 Joplin tornado","Information source"
"","@DPrimley Thank you so much  for following our efforts to find #shelter for disaster survivors! - Sparkrelief.org #Joplin #SlaveLake","73919793052397504","Donations of money, goods or services","","storm","ISCRAM2013","2011","2011 Joplin tornado","Donations of money, goods or services"
"","SCARY! @twilightus @AngWxGrl Terrifying!!!  @AngWxGrl #Joplin, MO: Before & After: http://tinyurl.com/4x8rsmt #tornado","73121834727518208","Caution and advice","","storm","ISCRAM2013","2011","2011 Joplin tornado","Caution and advice"
"","...tornado sirens...?","77073181025910704","Unknown","","storm","ISCRAM2013","2011","2011 Joplin tornado","Unknown"
""," @rocaeternaschoo: PLS , #CLT! SEEKING #Joplin org to assist 3 #marines making the trip to help w/ rescue! ALL have security & medic ...","74305868425990000","Donations of money, goods or services","","storm","ISCRAM2013","2011","2011 Joplin tornado","Donations of money, goods or services"
""," @DaveSnider: Good point: don't break into convoy.  2 Nat Guard troops were hurt yesterday when they were cut off on hwy.  2 fewer hel ...","74477585043693504","Unknown","","storm","ISCRAM2013","2011","2011 Joplin tornado","Unknown"
"","#Joplin's citizen looter patrol.  http://twitpic.com/583zoa","77960310736158704","Information source","","storm","ISCRAM2013","2011","2011 Joplin tornado","Information source"
"","President Obama visits tornado-ravaged Joplin, Missouri; speaks to survivors at memorial service. http://bit.ly/ev4tWQ","75523546973081600","Donations of money, goods or services","","storm","ISCRAM2013","2011","2011 Joplin tornado","Donations of money, goods or services"
"","What? There was a tornado in Northern Ireland today? What? #endofdays","78513512791552000","Unknown","","storm","ISCRAM2013","2011","2011 Joplin tornado","Unknown"
"","BREAKING #WEATHER: All damage has been surveyed at the tornado locations, and NWS concludes it was an EF3 tornâ€¦ (cont) http://deck.ly/~suVT6","76835618067447808","Information source","","storm","ISCRAM2013","2011","2011 Joplin tornado","Information source"
""," @Flickr: Member photos show the effects of the monster tornado in #Joplin http://bit.ly/k2YU57","72901215121440704","Information source","","storm","ISCRAM2013","2011","2011 Joplin tornado","Information source"
"","Ultra-loud warning sirens of the type used in the United States' ""tornado alley"" are being mooted for... http://dlvr.it/TQ78t","74917728753954800","Information source","","storm","ISCRAM2013","2011","2011 Joplin tornado","Information source"
""," @lights: Good vid, good cause!  @mikeziemer New @christoferdrew (NSN) song... w/ footage of Joplin tornado & ways to donate: http:/ ...","76486938714050400","Donations of money, goods or services","","storm","ISCRAM2013","2011","2011 Joplin tornado","Donations of money, goods or services"
"","How to Design a Tornado Safe Room http://ow.ly/56VpL #HomeDesign #Architecture","76256948848308096","Caution and advice","","storm","ISCRAM2013","2011","2011 Joplin tornado","Caution and advice"
"","Tornado death toll rises, no more survivors found http://bit.ly/l8TGAq","73600929592647600","Casualties and damage","","storm","ISCRAM2013","2011","2011 Joplin tornado","Casualties and damage"
"","Tornado warning for southern Sedgwick County and southwest Butler County until 8:30 p.m. Storm capable of tornado near Goddard. #ksstorms","78987546595561408","Caution and advice","","storm","ISCRAM2013","2011","2011 Joplin tornado","Caution and advice"
""," @TWCBreaking: Reports of minor tree damage coming in from Overland Park, KS, per emerg. mgt.   #tornado","73461635917946800","Casualties and damage","","storm","ISCRAM2013","2011","2011 Joplin tornado","Casualties and damage"
"","Lmfaooo  @MILLZ_PAPER: 0__o do u know what a toranado is? @M_INAPPROPRIATE: All I kno is tht tornado better not touch down on the ground","76015591185592304","Unknown","","storm","ISCRAM2013","2011","2011 Joplin tornado","Unknown"
""," @kcchiefs: HELP: Tornado Relief Fund - Please consider donating anything you can spare to this terrific cause. - http://t.co/IoZxshM","78492993321046000","Donations of money, goods or services","","storm","ISCRAM2013","2011","2011 Joplin tornado","Donations of money, goods or services"
"","Tornado in Springfield, MA. This is crazy. I hope friends in Boston are safe! http://huff.to/mFBizj","76308944653520800","Caution and advice","","storm","ISCRAM2013","2011","2011 Joplin tornado","Caution and advice"
"","MT @mariyastrauss MT @FeedingAmerica Agencies for @ozksfoodharvest helping communities in Joplin, MO. http://bit.ly/irJ1mc #tornado #Joplin","72777923505033200","Donations of money, goods or services","","storm","ISCRAM2013","2011","2011 Joplin tornado","Donations of money, goods or services"
"","Joplin tornado aftermath: ","73390277389328304","Unknown","","storm","ISCRAM2013","2011","2011 Joplin tornado","Unknown"
"","US day 1 #severe #weather outlook updated #WIND: 30% #HAIL: 30% #TORNADO: 5%  http://goo.gl/IzrNI http://wickedwx.com/2011/06/08/ #wx 55925","78560202152095600","Caution and advice","","storm","ISCRAM2013","2011","2011 Joplin tornado","Caution and advice"
""," @ShawnRyanTV: Hey Guy on CNN w/Home Video of tornado aftermath: Next time put the camera down while frantically searching for missing ...","74072846904721408","Information source","","storm","ISCRAM2013","2011","2011 Joplin tornado","Information source"
""," @MyTexasWeather:  @SgtAndyNorris  @TWCBreaking: Tornado with debris reported in southeast Dallas per NWS Chat. Large wedge near I ...","73220844096196608","Caution and advice","","storm","ISCRAM2013","2011","2011 Joplin tornado","Caution and advice"
""," @SantaFeTow: Emergency Blood Drive for #JOPLIN today at 2pm - American Red Cross: KCMO  211 West Armour Boulevard in #KansasCity, MO  ...","72746304878546800","Donations of money, goods or services","","storm","ISCRAM2013","2011","2011 Joplin tornado","Donations of money, goods or services"
""," @aegirl_2012: Tornado in Bloomington... http://bit.ly/lXWKcW","73914701586763600","Caution and advice","","storm","ISCRAM2013","2011","2011 Joplin tornado","Caution and advice"
""," @nytimes: Delivering the bad news of the aftermath of the tornado weighs on a Joplin, Mo., police chaplain http://nyti.ms/iTohba","74439989336866800","Casualties and damage","","storm","ISCRAM2013","2011","2011 Joplin tornado","Casualties and damage"
"","Tornado Warning for Beaver County in OK until 8:30pm CDT","79715300337127296","Caution and advice","","storm","ISCRAM2013","2011","2011 Joplin tornado","Caution and advice"
"","@walterolson Man clearing tornado debris fined for tree trimming http://j.mp/kgfWVn/// Didya even read the entire article? @cspanwj","77746523953311600","Information source","","storm","ISCRAM2013","2011","2011 Joplin tornado","Information source"
""," @txskywtchr: Here's a map of every county in Texas that is currently under a Burn Ban. Expect this list to grow. http://ow.ly/5ekuj # ...","78946699669803008","Information source","","storm","ISCRAM2013","2011","2011 Joplin tornado","Information source"
""," @tachmonite: #Joplin beasts beat up their cops because they don't like #WBC telling them that God sent the EF5 tornado. Cops tear gas ...","74926946412277600","Unknown","","storm","ISCRAM2013","2011","2011 Joplin tornado","Unknown"
""," @NewsOneOfficial: Obama Consoles Tornado-Ravaged Joplin: JOPLIN, Mo. -- Exactly a week after Joplin was nearly leveled by the dead... ...","75166698495426400","People missing, found or seen","","storm","ISCRAM2013","2011","2011 Joplin tornado","People missing, found or seen"
""," @SandiPattyP:  @jabberjoy: @SandiPattyP  Plz (1)OKC tornado victims shelter at Piedmont Baptist Church. Red Cross there. PLASTIC  ...","73222298148151200","Donations of money, goods or services","","storm","ISCRAM2013","2011","2011 Joplin tornado","Donations of money, goods or services"
"","#Joplin MO residents find X-rays from a hospital that was struck by a tornado 70 miles away","72595866690650000","Casualties and damage","","storm","ISCRAM2013","2011","2011 Joplin tornado","Casualties and damage"
"","NFL Collecting Funds To Aid Tornado Victims: By SportsDirect Three NFL teams have begun collecting supplies and ... http://bit.ly/ljg5KM","73447060216614800","Donations of money, goods or services","","storm","ISCRAM2013","2011","2011 Joplin tornado","Donations of money, goods or services"
""," @ModernMom: Dog rescues another dog in #Joplin http://bit.ly/iHwff2","74181613356990400","Information source","","storm","ISCRAM2013","2011","2011 Joplin tornado","Information source"
""," @studentadvisor: This Week in College News: Tornado Relief, ROTC and Rebecca Black http://t.co/PBn8GKH #college #highered","76709118286643200","Donations of money, goods or services","","storm","ISCRAM2013","2011","2011 Joplin tornado","Donations of money, goods or services"
""," @SippyCupMom: #Blog4Joplin has raised over $1,000! We STILL have blog accepting advertisers for as low as $5 a month will proceeds go ...","76004654818926400","Donations of money, goods or services","","storm","ISCRAM2013","2011","2011 Joplin tornado","Donations of money, goods or services"
""," @BadAstronomer:  @samc76: we need nurses or doctors looking to help re #Joplin,MO, call 417-832-9500 for the Greater Ozarks of the  ...","72656329503805408","Donations of money, goods or services","","storm","ISCRAM2013","2011","2011 Joplin tornado","Donations of money, goods or services"
""," @BreakingNews: Spotters confirm a tornado on the ground moving toward Joplin, Mo., where a twister on Sunday killed 124 people - CNN","73262153649496000","Caution and advice","","storm","ISCRAM2013","2011","2011 Joplin tornado","Caution and advice"
"","The wonderful @TaylorSwift13 raises almost $1M for tornado victims! Read the story and watch a clip from the show http://spr.ly/6019REgS","75573450059689904","Donations of money, goods or services","","storm","ISCRAM2013","2011","2011 Joplin tornado","Donations of money, goods or services"
"","Geesh!  How long since the tornado?3 weeks??? @KrisKetz:  @koamnews: FEMA trailers arrive for tornado relief http://bit.ly/kv6DXp","79754524235010000","Information source","","storm","ISCRAM2013","2011","2011 Joplin tornado","Information source"
"","Check this video out -- Stunning Water tornado blasts Australia coast. http://t.co/gIbUldt via @youtube","75205294384361408","Information source","","storm","ISCRAM2013","2011","2011 Joplin tornado","Information source"
"","About to head to Sweet Home Alabama to help with Tornado Relief Efforts. Will be in Bham tonight (Lord willing)","74931342193864704","Donations of money, goods or services","","storm","ISCRAM2013","2011","2011 Joplin tornado","Donations of money, goods or services"
"","Missouri town says 232 missing after tornado: Officials Thursday said 232 people were still missing four days af... http://bit.ly/kW9HQn","73823143323643904","People missing, found or seen","","storm","ISCRAM2013","2011","2011 Joplin tornado","People missing, found or seen"
""," @TWCBreaking: Tornado reported on the observation at Dallas' Love Field. #txwx","73198374110756800","Caution and advice","","storm","ISCRAM2013","2011","2011 Joplin tornado","Caution and advice"
""," @PFCinKC: call 866-892-3228 for referrals to available child care in Joplin during recovery efforts.  #MoHaves Please ","72804597529448400","Donations of money, goods or services","","storm","ISCRAM2013","2011","2011 Joplin tornado","Donations of money, goods or services"
"","Massachusetts Tornadoes Make for Popular YouTube Content As previously discussed, 2011 has been the Year of the Tornado, http://tiny.ly/BbgL","77155345574797200","Information source","","storm","ISCRAM2013","2011","2011 Joplin tornado","Information source"
""," @emre_yilmaz: Making MySQL Queries Asynchronous in Tornado, http://chart.io/2011/making-mysql-queries-asynchronous-in-tornado/ #fb","79665621842919296","Unknown","","storm","ISCRAM2013","2011","2011 Joplin tornado","Unknown"
"","@CBS42 please RT, Pray for our team taking donations to Joplin today! Thanks for the support from everyone!! #wearealabama #Joplin","76744552555356000","Donations of money, goods or services","","storm","ISCRAM2013","2011","2011 Joplin tornado","Donations of money, goods or services"
""," @ViennaKISS: 2 days left to bid on autographed MCR drumhead to help tornado victims in Mississippi ! http://www.tinyurl.com/HelpMCRHelpMS","75980740675907504","Donations of money, goods or services","","storm","ISCRAM2013","2011","2011 Joplin tornado","Donations of money, goods or services"
"","#Obama tours twister-ravaged neighborhood in #Joplin  http://bre.ad/0cmin0 #news","74941215900049408","Information source","","storm","ISCRAM2013","2011","2011 Joplin tornado","Information source"
"","Goodyear Blimps Assist Tornado Relief Effort: AKRON, Ohio, May 27, 2011 /PRNewswire/ -- The Goodyear Tire & Rubb... http://prn.to/lskBqa","74183700966940608","Donations of money, goods or services","","storm","ISCRAM2013","2011","2011 Joplin tornado","Donations of money, goods or services"
""," @NBCActionNews: 89 confirmed deaths in #Joplin tornado #motornados","72646038405660608","Casualties and damage","","storm","ISCRAM2013","2011","2011 Joplin tornado","Casualties and damage"
