"relevant","tweet_text","tweet_id","humanitarian_label","original_humanitarian_label","event_type","dataset","year","event_name","original_relevant_label"
"True","Oh great. Another tornado on the ground just north of Azle. Be safe everybody!","99799228891449797654","","","storm","ISCRAM2013","2011","2011 Joplin tornado",""
"True","It's time to assume your post-tornado positions: front yardhands on hips surveying damage talk with neigbors about said damage #tornadoup","99537880256073383109","","","storm","ISCRAM2013","2011","2011 Joplin tornado",""
"True","Is prayng for everyone around the country with this tornado outbreak going on.","99245731973790251232","","","storm","ISCRAM2013","2011","2011 Joplin tornado",""
"True","Confirmed tornado just northwest of fort worth.","99554262635767421447","","","storm","ISCRAM2013","2011","2011 Joplin tornado",""
"True","@heelsandracing Tornado warning for your area? I hope you're in a solid structure. Safe safe tonight!","99885845400321119981","","","storm","ISCRAM2013","2011","2011 Joplin tornado",""
"True","How awesome. My family in Ark City/Winfield is now in a tornado warning. #seriously?!","99939230586321293924","","","storm","ISCRAM2013","2011","2011 Joplin tornado",""
"True","We just got out of the storm shelter. The F4 or 5 tornado hit less than a mile from our house. It was very scary & sir ...","99930720449554164864","","","storm","ISCRAM2013","2011","2011 Joplin tornado",""
"True","Grab toto please!! RT""""@JoeBucsFan: """"Looks like a tornado is coming into town.""""""""","99433396803601561948","","","storm","ISCRAM2013","2011","2011 Joplin tornado",""
"True","watching idol now since the other 3 networks are on tornado coverage.  that scotty kid makes weird faces.","99461528970237549792","","","storm","ISCRAM2013","2011","2011 Joplin tornado",""
"True","It's a tornado warning every damn day! Geesh!","99952410373068858856","","","storm","ISCRAM2013","2011","2011 Joplin tornado",""
"True","Tornado warning last night.My girls were up ALL night.But any way.My dad and I had alone time while fishing.I cuaght a bass.","99007753846149916119","","","storm","ISCRAM2013","2011","2011 Joplin tornado",""
"True","please pray for the tornado victims.. PLEASE..","99011404810471445950","","","storm","ISCRAM2013","2011","2011 Joplin tornado",""
"True","A couple of homes """"are missing"""" in Stillwater according to KOTV. Not sure what that means. Debris scattered everywhere? #okwx","99412615236405693340","","","storm","ISCRAM2013","2011","2011 Joplin tornado",""
"True","#tornado #tornado #tornado #tornado #thunderup #mavscansuckmydick","99639515880269495178","","","storm","ISCRAM2013","2011","2011 Joplin tornado",""
"True","Thunder is increasing and getting louder here in Catoosa.  #okwx","99164178299365166003","","","storm","ISCRAM2013","2011","2011 Joplin tornado",""
"True","A #Tornado Warning issued for Mitchell County in #Kansas until 8:15pm CDT. #KS","99507755995668362211","","","storm","ISCRAM2013","2011","2011 Joplin tornado",""
"True","@Alliswimm delayed prolly cauz of that tornado nonsense? @Hajimeezy reading?","99727879206683569310","","","storm","ISCRAM2013","2011","2011 Joplin tornado",""
"True","Tornado reported in Denton County Texas near I-35 W and FM 407.","99414947101676008457","","","storm","ISCRAM2013","2011","2011 Joplin tornado",""
"True","Up here in McKinney we'll likely be taking tornado precautions shortly. If nothing else hail in Western collin may be ...","99229573041550096704","","","storm","ISCRAM2013","2011","2011 Joplin tornado",""
"True","under tornado watch funnnn","99327546022297643172","","","storm","ISCRAM2013","2011","2011 Joplin tornado",""
"True","Any 'news' organization in the US that is not live on the massive tornado outbreak in OK area tonight = #epic #FAIL.","99252426442893483866","","","storm","ISCRAM2013","2011","2011 Joplin tornado",""
"True","Rescuers searched for survivors after the state of Missouri was hit with the worst ever recorded tornado in US... http://fb.me/Ywt7GKLC","99302064113132529895","","","storm","ISCRAM2013","2011","2011 Joplin tornado",""
"True","Dear #Oklahoma could you stop with the whole #tornado bit... I'm so over it.","99200936371538734652","","","storm","ISCRAM2013","2011","2011 Joplin tornado",""
"True","Wow watching CNN and just watched a tornado take out an 18 wheeler","99977140387405514601","","","storm","ISCRAM2013","2011","2011 Joplin tornado",""
"True","Another tornado! My heart goes out to all the victims of these killer tornadoes. :-(","99283577490137680251","","","storm","ISCRAM2013","2011","2011 Joplin tornado",""
"True","We dodged the F4 tornado tonight. Roped-out before getting within 5 miles.","99225958273159062568","","","storm","ISCRAM2013","2011","2011 Joplin tornado",""
"True","Follow @kskinder for storm updates. He's tracking from central OK going east with the storms. #okwx #arwx","99203003446108913766","","","storm","ISCRAM2013","2011","2011 Joplin tornado",""
"True","Tulsa area start taking precautions now. The storm is closing in on the metro area. Stay safe. Don't take chances. #okwx","99301821713585738679","","","storm","ISCRAM2013","2011","2011 Joplin tornado",""
"True","Guy just asked if Brees would agree to boxing match w/Peyton Manning to raise $ for tornado relief. Brees: """"There's gotta be a better way.""""","99116664385256049188","","","storm","ISCRAM2013","2011","2011 Joplin tornado",""
"True","@andersoncooper you are clearly not from Kansas. If you were you'd be broadcasting with an approaching tornado in the background!","99958591663530301649","","","storm","ISCRAM2013","2011","2011 Joplin tornado",""
"True","No more tornado - time for braums ice cream - line is packed","99158231021910590703","","","storm","ISCRAM2013","2011","2011 Joplin tornado",""
"True","It's Getting Scary Out There. Nowadays There's ALWAYS A Tornado Hurricane Or Earthquake. O.O","99755012775037703412","","","storm","ISCRAM2013","2011","2011 Joplin tornado",""
"True","BREAKING NEWS - Tornado watch issued for area including Joplin Missouri where at least 124 people died in a twister Sunday. #cnn","99390129351899248404","","","storm","ISCRAM2013","2011","2011 Joplin tornado",""
"True","@timothyjbrenner you are gonna have to ship me some new Gap undies! Is that a tornado forming?","99242387196334910602","","","storm","ISCRAM2013","2011","2011 Joplin tornado",""
"True","Are we still talkin bout the tornado?!? I almost think you're talking about me....lol!!! @HennySypr4Lyf","99525967030727817515","","","storm","ISCRAM2013","2011","2011 Joplin tornado",""
"True","Libs still show disrespect to tornado victims by claiming Global Warming is to blame. Everytime I see this it makes me sick.","99426166653508286286","","","storm","ISCRAM2013","2011","2011 Joplin tornado",""
"True","eating dinner in a tornado shelter. #oklahoma #fb","99429290617596188451","","","storm","ISCRAM2013","2011","2011 Joplin tornado",""
"True","Tornado on the ground in reno tx between Azle & springtown. Get inside & be safe.","99197564405350748228","","","storm","ISCRAM2013","2011","2011 Joplin tornado",""
"True","Tornado Warning issued May 24 at 7:46PM CDT expiring May 24 at 8:30PM CDT by NWS Norman-Oklahoma City... http://dlvr.it/StPdd","99607505166508227102","","","storm","ISCRAM2013","2011","2011 Joplin tornado",""
"True","Prayers for the people of North Eastern Texas. Tornado sirens went off there too.","99921210604459612348","","","storm","ISCRAM2013","2011","2011 Joplin tornado",""
"True","One of my bestfriends lost their house in a tornado. #PrayforOklahoma","99718505040283234074","","","storm","ISCRAM2013","2011","2011 Joplin tornado",""
"True","Where u live? RT @Darkskin Just took cover...damn Tornado landed about 15 minutes ago. Sirens and alarms are going off like crazy.","99500042881188542447","","","storm","ISCRAM2013","2011","2011 Joplin tornado",""
"True","russell kansas tornado warning","99819660491778295414","","","storm","ISCRAM2013","2011","2011 Joplin tornado",""
"True","Anyone traveling...please be careful!!! Esp in North Texas. We're under a tornado watch. Not a warning anymore.","99136613499693208787","","","storm","ISCRAM2013","2011","2011 Joplin tornado",""
"False","@vocalbeing they tombout tornado weather 2mar","99150796000789099497","","","storm","ISCRAM2013","2011","2011 Joplin tornado",""
"True","A new tornado watch has been issued for extreme eastern Kansas and western Missouri...including Joplin...u ...","99218641339456057724","","","storm","ISCRAM2013","2011","2011 Joplin tornado",""
"True","#prayforjoplin   #prayforoklahoma    tornado season","99613993780836697720","","","storm","ISCRAM2013","2011","2011 Joplin tornado",""
"True","@info4disasters as in triage? Or just one person?  #1stAid4 #okwx #Joplin","99800535537131809814","","","storm","ISCRAM2013","2011","2011 Joplin tornado",""
"True","Ne and all ppl in peidmont Oklahoma get below ground now! Massive tornado on the ground!","99366573244117889561","","","storm","ISCRAM2013","2011","2011 Joplin tornado",""
"True","Watching tornado hell on tv.","99495226087039307209","","","storm","ISCRAM2013","2011","2011 Joplin tornado",""
"True","@gbagnation A WATCH is be cautious a tornado is possible. A WARNING is a tornado is on the ground.","99733422887542421081","","","storm","ISCRAM2013","2011","2011 Joplin tornado",""
"True","Joplin Missouri where at least 124 died Sunday under #tornado watch http://on.cnn.com/k1ZN2b","99879774074544550569","","","storm","ISCRAM2013","2011","2011 Joplin tornado",""
"True","My wife's aunt survived Sunday's tornado in Joplin by getting between her bed and the wall. Nothing left of her apartment a brick duplex!","99677140629523006193","","","storm","ISCRAM2013","2011","2011 Joplin tornado",""
"True","@JackOfallArts tornado","99985096981177761757","","","storm","ISCRAM2013","2011","2011 Joplin tornado",""
"True","It sucks ReallyBut hey You decided to set up shop in an area Nicknamed """"Tornado Alley""""Nothing good comes outof the words Tornado and Alley","99339169614000059420","","","storm","ISCRAM2013","2011","2011 Joplin tornado",""
"False","was perhaps a mistake to listen to audio taken inside a tornado #joplin #nightmares","99171286000690162942","","","storm","ISCRAM2013","2011","2011 Joplin tornado",""
"True","1Way is collecting items to take to tornado victims such as soap shampoo toothbrushes etc. Bring them to 1Way 2mro!","99284969513833914439","","","storm","ISCRAM2013","2011","2011 Joplin tornado",""
"True","Getting our gear on @hkatherinechloe #Tornado #tornadohunt","99725716973511663956","","","storm","ISCRAM2013","2011","2011 Joplin tornado",""
"True","Denton area watch out. Decatur has a tornado warning up. Storm cell is moving into Denton area soon. o(;A;)o Home & kitties plz be safe..","99322902533857949974","","","storm","ISCRAM2013","2011","2011 Joplin tornado",""
"True","please pray for the tornado victims.. PLEASE..","99145796761715421725","","","storm","ISCRAM2013","2011","2011 Joplin tornado",""
"True","Well hell... They just reissued a tornado watch for Yukon again... I quit!","99585994810263606200","","","storm","ISCRAM2013","2011","2011 Joplin tornado",""
"True","#Joplin #severe threat accelerated!    2 hours from now.   RIGHT NOW Damaging winds and hail appear to be biggest threat.","99673400951472130210","","","storm","ISCRAM2013","2011","2011 Joplin tornado",""
"True","Two dead from Oklahoma tornado http://sockroll.com/fq69o9","99563767826373282110","","","storm","ISCRAM2013","2011","2011 Joplin tornado",""
"True","My heard goes out to all affected! RT @HuffPostGreen: As death toll rises Joplin tornado now deadliest since 1950 http://huff.to/l9SyRT","99838518131227924448","","","storm","ISCRAM2013","2011","2011 Joplin tornado",""
"True","Big tornado hits Oklahoma City at rush hour http://bit.ly/jR9aC1","99904657410106794627","","","storm","ISCRAM2013","2011","2011 Joplin tornado",""
"True","How sad. I can't imagine losing my home and everything. Watching live OK tornado coverage: http://www.kirotv.com/video/28009842/index.html","99911957705130616535","","","storm","ISCRAM2013","2011","2011 Joplin tornado",""
"True","Joplin Missouri where at least 124 died Sunday under #tornado watch http://on.cnn.com/k1ZN2b","99708915811394996153","","","storm","ISCRAM2013","2011","2011 Joplin tornado",""
"True","Take shelter the tornado just hit frisco/plano area!!","99193037730599109914","","","storm","ISCRAM2013","2011","2011 Joplin tornado",""
"True","This weather is crazy now tornado watch","99447467098289243048","","","storm","ISCRAM2013","2011","2011 Joplin tornado",""
"True","Multiple #tornado reports in Tarrant County. Heading at D/FW airport. #txwx #severe","99866001156380518627","","","storm","ISCRAM2013","2011","2011 Joplin tornado",""
"True","Survived the tornado in the band room with my friends. Went to Chick-Fil-A. Had rehearsal. Talked for an hour. Here I am now. #RaptureRecap","99431499427792303736","","","storm","ISCRAM2013","2011","2011 Joplin tornado",""
"True","Relatives Lose Everything in Tornado","99598242165690430157","","","storm","ISCRAM2013","2011","2011 Joplin tornado",""
"True","Relatives Lose Everything in Tornado","99206371239241594997","","","storm","ISCRAM2013","2011","2011 Joplin tornado",""
"False","Tornado deathstorm 2011 was such a dud","99821441440526827560","","","storm","ISCRAM2013","2011","2011 Joplin tornado",""
"True","Weather service issues #tornado watch for western Missouri extreme eastern Kansas http://on.cnn.com/k1ZN2b","99605832201295528966","","","storm","ISCRAM2013","2011","2011 Joplin tornado",""
"True","Praying 4 no damage RT @KansasAgland: Tornado warning in Barton County- weather all around central Kansas - why can't we get a nice shower?","99557203565040067280","","","storm","ISCRAM2013","2011","2011 Joplin tornado",""
"True","Just in: Tornado watch issued for eastern Kansas and western Missouri. Area includes #Joplin Missou ...","99546205969708396705","","","storm","ISCRAM2013","2011","2011 Joplin tornado",""
"True","Please #pray for 3 yr old child still missing from Oklahoma tornado (didn't get location).","99670062629300052462","","","storm","ISCRAM2013","2011","2011 Joplin tornado",""
"True","Sooo We Gt A Tornado Watch Here... #Ugh I Hate Dhis !","99735685662818461396","","","storm","ISCRAM2013","2011","2011 Joplin tornado",""
"True","I'm scared!!!!! Tornado!!!!","99911527965522840433","","","storm","ISCRAM2013","2011","2011 Joplin tornado",""
"True","Tornado Watch issued May 24 at 7:33PM CDT expiring May 24 at 10:00PM CDT by NWS Norman-Oklahoma City... http://bit.ly/iEqPjm  #okwx","99749096067626164895","","","storm","ISCRAM2013","2011","2011 Joplin tornado",""
"True","the local tornado warning has been upgraded to a tornado watch.. GASP!","99238884869979957628","","","storm","ISCRAM2013","2011","2011 Joplin tornado",""
"True","The storm is stretching from texas to kansas","99521212827910264610","","","storm","ISCRAM2013","2011","2011 Joplin tornado",""
"True","Word is that our semi driver that was hit by the tornado near Shawnee has minor injuries #okwx","99270227040890296440","","","storm","ISCRAM2013","2011","2011 Joplin tornado",""
"True","gainseville texas tornado warning","99252021411250025317","","","storm","ISCRAM2013","2011","2011 Joplin tornado",""
"True","Our parents have decided that @nicole_lexus's boots are good tornado shoes hahaha","99490017982665585662","","","storm","ISCRAM2013","2011","2011 Joplin tornado",""
"True","please pray for the tornado victims.. PLEASE..","99434747060353396129","","","storm","ISCRAM2013","2011","2011 Joplin tornado",""
"True","@RobAlgoziniJr shit yea TX now! It's ugly over here and we are far from the tornado area but have storm watch","99181250018936968296","","","storm","ISCRAM2013","2011","2011 Joplin tornado",""
"True","Libs should be helping & supporting the tornado vicims not exploiting them for their political views regarding global warming.","99971257508834106169","","","storm","ISCRAM2013","2011","2011 Joplin tornado",""
"True","Yea now we're under a tornado warning. This is exhausting!","99293452233356705780","","","storm","ISCRAM2013","2011","2011 Joplin tornado",""
"False","@LasBarVondysTx QUE DIOS TE BENDIGA! QUE MIEDO ES EN CERIO QUE VA A HABER UN TORNADO?","99097720382478416251","","","storm","ISCRAM2013","2011","2011 Joplin tornado",""
"True","Tornado Warning  ahhhhhh","99866562033966086315","","","storm","ISCRAM2013","2011","2011 Joplin tornado",""
"True","First Baptist Church in Piedmont opening up as shelter...please help get word out! #okwx","99340167204114980472","","","storm","ISCRAM2013","2011","2011 Joplin tornado",""
"True","Apparently drove through the rain wrapped tornado while heading home through Noble. #ihateoklahomaweather. Thank you hail. NOT.","99598159568942078387","","","storm","ISCRAM2013","2011","2011 Joplin tornado",""
"True","Tornado warning just issued.","99265376680586039538","","","storm","ISCRAM2013","2011","2011 Joplin tornado",""
"True","Be safe #Oklahoma playing dodge that tornado. #severeweather","99047434557627993190","","","storm","ISCRAM2013","2011","2011 Joplin tornado",""
"True","Got to use our basement for the second time since 2007... Just about done riding out the tornado warning.","99590597974163903486","","","storm","ISCRAM2013","2011","2011 Joplin tornado",""
"True","please pray for the tornado victims.. PLEASE..","99387812799054748185","","","storm","ISCRAM2013","2011","2011 Joplin tornado",""
"True","I wonder if kc is under a tornado watch?  Have not heard anything.","99520141921722895110","","","storm","ISCRAM2013","2011","2011 Joplin tornado",""
"True","A multi vortex tornado is scarier than a tsunami","99498645078008490979","","","storm","ISCRAM2013","2011","2011 Joplin tornado",""
"True","Cantor is holding tornado victims HOSTAGE to his #failed budget!  NO AID WITHOUT PASSING HIS PLAN #mizzou #joplin #GO ...","99423712419726041370","","","storm","ISCRAM2013","2011","2011 Joplin tornado",""
"True","Had several adult beverages during/after the tornado...","99573628095978012983","","","storm","ISCRAM2013","2011","2011 Joplin tornado",""
"True","Here we go again...A Tornado Watch is in effect until 3:00 am for Buchanan Caldwell Clinton Platte.","99314770015522406438","","","storm","ISCRAM2013","2011","2011 Joplin tornado",""
"True","@blakeshelton I was streaming online and viewing the damage. So hard to watch. Saw a lil girl walking around tornado damaged home :(.","99028498140443381684","","","storm","ISCRAM2013","2011","2011 Joplin tornado",""
"True","Death toll rises to 118 as Missouri braces for more bad weather: The death toll from the tornado that burst thro... http://bit.ly/kLk9Mx","99509232162566309122","","","storm","ISCRAM2013","2011","2011 Joplin tornado",""
"True","Hey remember that time that tornado hit independence and destroyed the Arby's?","99306244629636427797","","","storm","ISCRAM2013","2011","2011 Joplin tornado",""
"True","@ottguy Holy shit the tornado that hit Joplin was officially classified as an F5 w sustained winds of 340 km/h. :O","99087493417213753815","","","storm","ISCRAM2013","2011","2011 Joplin tornado",""
"True","tornado watch #amazing","99339555927182631228","","","storm","ISCRAM2013","2011","2011 Joplin tornado",""
"True","@kfor absolutely fantastic coverage with your #tornado coverage. watching from central massachusetts. my prayers are with you","99578495565398334231","","","storm","ISCRAM2013","2011","2011 Joplin tornado",""
"True","Waiting and watching for tornados and hail... tornado near fort worth..eek!!!!","99630246720147965227","","","storm","ISCRAM2013","2011","2011 Joplin tornado",""
"True","Just took cover...damn Tornado landed about 15 minutes ago. Sirens and alarms are going off like crazy.","99090111204068329708","","","storm","ISCRAM2013","2011","2011 Joplin tornado",""
"True","Tulsa area start taking precautions now. The storm is closing in on the metro area. Stay safe. Don't take chances. #okwx","99318696266184719873","","","storm","ISCRAM2013","2011","2011 Joplin tornado",""
"True","TORNADO WARNING!!!!!","99262568186761055159","","","storm","ISCRAM2013","2011","2011 Joplin tornado",""
"True","@katiekathleen tornado face indeed!","99136722518989952757","","","storm","ISCRAM2013","2011","2011 Joplin tornado",""
"True","@chrisjaber you guys are just jealous of our cookies and our comfy tornado shelter.","99415324858248063032","","","storm","ISCRAM2013","2011","2011 Joplin tornado",""
"False","any HAM operators in #OK Tweeps let find them and get the word out #Anonymous #Anonymiss #OKwx #severwx","99629525189374037786","","","storm","ISCRAM2013","2011","2011 Joplin tornado",""
"True","We are under a tornado watch until 1:23am.","99384796592039217947","","","storm","ISCRAM2013","2011","2011 Joplin tornado",""
"True","@nancyj87 I give up altogether trying to figure this out. At one point during the tornado warning the SUN came out! hahah I dunno anymore..","99778345751026035149","","","storm","ISCRAM2013","2011","2011 Joplin tornado",""
"True","please pray for the tornado victims.. PLEASE..","99288257637723220037","","","storm","ISCRAM2013","2011","2011 Joplin tornado",""
"True","Oh sh!t #Tornado watch here in lake Dallas the siren just came on","99859170185519482033","","","storm","ISCRAM2013","2011","2011 Joplin tornado",""
"True","Have you ever noticed that those tornado warnings always come on during the show and never during the commercials?","99886000406038633063","","","storm","ISCRAM2013","2011","2011 Joplin tornado",""
"True","Tornado Warning.!!!","99974735456304131825","","","storm","ISCRAM2013","2011","2011 Joplin tornado",""
"True","please pray for the tornado victims.. PLEASE..","99219795760005467937","","","storm","ISCRAM2013","2011","2011 Joplin tornado",""
"True","@SlicedSmoke14 It get worse... Dallas and Forth Worth is about to be under tornado warning.","99696403833108365038","","","storm","ISCRAM2013","2011","2011 Joplin tornado",""
"True","@ShrenAKO Wait...are you still on a tornado watch?!","99158947668645422479","","","storm","ISCRAM2013","2011","2011 Joplin tornado",""
"False","EE.UU.: Al menos 122 muertos y 750 heridos por tornado en Misuri http://ow.ly/52g6Y","99985746980709300727","","","storm","ISCRAM2013","2011","2011 Joplin tornado",""
"True","Watching American Idol and hoping that tornado warned storms miss us","99825705498792440327","","","storm","ISCRAM2013","2011","2011 Joplin tornado",""
"True","Tornado Warning !!!! Denton People take cover tho real t its suppose to come through yall soon! God Bless ! Pray to Moloch ASAP !","99626181221044775126","","","storm","ISCRAM2013","2011","2011 Joplin tornado",""
"True","tornado on the grond in ft worth and the stop covering it to show glee?! I miss Gary England... And his drinking game","99301068677268235989","","","storm","ISCRAM2013","2011","2011 Joplin tornado",""
"True","124 Dead as More Tornadoes Head to Joplin Mo.: The death toll from the monster tornado that struck Joplin Mo.... http://bit.ly/kNbONO","99887837282775549627","","","storm","ISCRAM2013","2011","2011 Joplin tornado",""
"True","@spreadingJOY yes ..we are in tornado season!! big line of storms still heading east thru the state","99324945471576102539","","","storm","ISCRAM2013","2011","2011 Joplin tornado",""
"True","118 people died during the Tornado in Missouri....so sad :(","99399639898606458189","","","storm","ISCRAM2013","2011","2011 Joplin tornado",""
"True","I peed two time in the back of the bus hehehe during a tornado watcj/warning","99947541581913639343","","","storm","ISCRAM2013","2011","2011 Joplin tornado",""
"True","#Joplin #severe threat accelerated!    2 hours from now.   RIGHT NOW Damaging winds and hail appear to be biggest threat.","99873690917087205847","","","storm","ISCRAM2013","2011","2011 Joplin tornado",""
"True","tornado warning denton!","99013709070271925352","","","storm","ISCRAM2013","2011","2011 Joplin tornado",""
"True","Damn dat tornado was fckn huge as shit!","99754115621193859311","","","storm","ISCRAM2013","2011","2011 Joplin tornado",""
"True","Tornado Watch issued for my area through 3am. As bad as tornadoes have been lately I'm glad to have a weatheer radio & tornado """"safe spot"""".","99997814499429272044","","","storm","ISCRAM2013","2011","2011 Joplin tornado",""
"True","Glad that my kids and I are safe. Sad cause I will not be able 2 finish my mix show 2night #okwx","99262380137935464461","","","storm","ISCRAM2013","2011","2011 Joplin tornado",""
"True","Pray for everyone that got hit by tornado :(","99833949501576697754","","","storm","ISCRAM2013","2011","2011 Joplin tornado",""
"True","God bless us all here in Ardmore a tornado is coming :'( I love u all!","99241969428357935746","","","storm","ISCRAM2013","2011","2011 Joplin tornado",""
"True","@wfaaweather Tornado sirens going off in Bedford. Why is Dancing with the stars on???","99269464489252145419","","","storm","ISCRAM2013","2011","2011 Joplin tornado",""
"True","Let us offer a short prayer for those peeps hit by the tornado in Oklahoma. God bless them.","99676769114421535051","","","storm","ISCRAM2013","2011","2011 Joplin tornado",""
"True","Tornado showing up on myownradar at www.wfaa.com/myownradar.  Click on INTENSE ROTATION. -sm","99637122010479436408","","","storm","ISCRAM2013","2011","2011 Joplin tornado",""
"True","Tornado warnings everywhere #whatthemess","99540418502405879863","","","storm","ISCRAM2013","2011","2011 Joplin tornado",""
"True","@andersoncooper Stay safe! Just saw terrifying freaky footage of a telephone pole going over a car in OK today during a tornado!","99938936637771378747","","","storm","ISCRAM2013","2011","2011 Joplin tornado",""
"True","Well they finally put us under a tornado warning....rotation n progress..God protect us all!","99392753745925923463","","","storm","ISCRAM2013","2011","2011 Joplin tornado",""
